	it is our experience that the 2009 genesis is absolutely the best value of any of the above cars - there is no comparison versus what hyundai packs into this vehicle for $40k when fully loaded.	1
	we could have chosen any car we wanted and yet opted for this because of our prior excellent experience with the azera and the fact that the genesis offers far more features and performance for much less money than any of the autos we have owned.favorite features:the fact that genesis has managed to pack in bluetooth, an ipod connector, a 6 cd changer and a nav system into the same vehicle which no other auto maker seems to have figured out how to do yet.	1
	either you get one or another but not all.	1
	in addition, lexus bluetooth is a known nightmare --suggested improvements:trunk on the azera is bigger and the azera's rear seats fold down to facilitate a large pass through.	1
	azera's rear seat room is also much more ample.	1
	but, when compared to lexus or our infiniti, the rear seat room easily beats them all.	1
	in net, about as good as it can get at any price!	1
	hyundai should be at the top of the list.like many others here, i too can't believe i even looked at hyundai, let alone getting one!	1
	i began researching this car early in the year.	1
	i was coming to lease end on a 2006 m45 sport and wanted something much less expensive, uses regular fuel and gets better gas mileage.	1
	i liked the handling dynamics of the m45 and was worried that i took a big step backwards in handling.	1
	not so!	1
	i have found myself taking the same turns and curves in the hyundai that i did with the m45 - at the same speeds - and the hyundai is just as 'planted' as was the m45.	1
	obviously the m was quicker, but i enjoy everything about the hyundai better.favorite features:nice roomy interior, large trunk.	1
	a sound system (lexicon) that you blow you out of the car.	1
	a quiet, smooth ride.	1
	i have only put about 800 miles on it and i am averaging 24 mpg!	1
	i love the navigation system and being able to play mp3's using the usb connection.suggested improvements:there is only one thing that i miss from the m45 that the hyundai does not have: the ability to use the key fob to roll down all the windows as you approach the car.	1
	but, that is the only thing that i miss.	1
	i certainly don't miss the higher monthly payment, higher fuel costs and lower gas mileage.	1
	underpriced luxury.i've owned this car one month with every passing week appreciating the genesis more and more.	1
	the technology features are plentiful and well thought out.	1
	dollar for dollar the genesis equipped with the tech package is a stunning value.	1
	the 290hp v6 engine is more than adequate for enthusiastic driving.	1
	the genesis handling is nicely balanced between sportiness and numbness with just enough road feel to inspire confidence and comfort.	1
	exterior noise does not penetrate the cabin yielding a wonderfully quiet ride.	1
	the 528w 17 speaker lexicon surround sound fills your driving experience with clear, crisp, enriching musical enjoyment.	1
	i considered 335xi, cts4, & es350, but bought a genesis.	1
	wow!favorite features:everything about the technology package, quiet ride, generous interior room front and back, exterior design, roomy trunk, and most of all - the remarkable value.suggested improvements:interior of the trunk is cheaply finished.	1
	expandable map pockets in the front doors have a sharp edge.	1
	passenger side seat should also have the cooling option.	1
	add a power console in the back with a 110v outlet to plug in a laptop or video game.	1
	offer a headrest dvd option.	1
	who needs a bmw 7?	1
	?.i've owned bm'ers since '89.	1
	just had my '05 745 turned in and said goodbye!	1
	the genesis is every bit the luxo ride.	1
	the v6 is faster than my 745 was.	1
	every day i fall further in love with it.	1
	the tech package is great[much easier than the i drive!]	1
	best thing is i can buy two genesis's for the price of a loaded 7!	1
	great car.favorite features:suggested improvements:	1
	perfect!	1
	!.this car is easily the nicest i have owned.	1
	i traded an acura for this and before that i had a mercedes.	1
	frankly, neither of them can compare to this car.	1
	it's superior in every way.	1
	i love telling people i traded my acura for a hyundai.favorite features:ride quality.suggested improvements:none yet.	1
	mission accomplished!!	1
	!.i was following & really looking forward to this motor car, so i bought it!	1
	owned 7 series & was nice compromise, esp.	1
	price.	1
	hyundai's first foray with an all-new rwd platform & v8 engine in this class is impressive.	1
	my car turns heads and i love its understated execution.	1
	has the luxury amenities i need and $$$ to spare.	1
	wish it was sold in a dedicated channel -- i.e., genesis brand -- wouldn't mind stripping the h logo and replacing it with domestic market genesis wings logo (front, back, wheel hub & horn pad)favorite features:easy to drive, smooth, quiet and refined.	1
	love the dis, lexicon audio & driver cooled seats.suggested improvements:wish that the brakes were more on par with vehicles in this class (see bmw b/mark).	1
	prefer a bit firmer handling & less body roll.	1
	would look dynamite with some nice wheels.	1
	agree that pass seat should be cooled as well.	1
	need much better dealer experience & more advertising!!	1
	brand needs enhancement	1
	a luxurious sedan.lease deal was $473/mo.	1
	$2199 upfront.	1
	i am quite satisfied its styling and convenience.	1
	platinum gray metallic has edge at every corner, awesome color.	1
	i really enjoy tight and rich should of lexicon.	1
	a hyundai, you've never seen before.favorite features:lexicon sound.suggested improvements:none.	1
	deja vu of 1989 lexus debut.we wanted to drive a vw passat, chevy malibu, and a genesis on the same day.	1
	went from the vw dealer to the hyundai and bought the genesis.	1
	there was no comparison, the other cars were nice mid size family cars (both with noted nice interiors), but couldn't hold a candle to the genesis.	1
	the big hyundai was quieter, smoother, and so much nicer on the inside and outside than the other two.	1
	it really reminded me of the lexus debut of the ls400 back in '89.	1
	i went to that knowing that this car was supposed to be different than any other toyota ever seen, but was blown away by how nice it really was.	1
	same feelings here.	1
	my wife is very happy with the car too.favorite features:build quality, materials, noise level (none), ride (smooth), features (lots).suggested improvements:dealer experience	1
	i can't believe its a hyundai.i can tell you from owning a bmw, that the hyundai genesis is a very comparable and as high a quality as you can believe.it has great extras with the navigation and bluetooth.	1
	you can't ask for much more in a beautiful car.	1
	great style and luxury.favorite features:love the front gill not having the flying h.suggested improvements:the only bad thing that i can really complain about is the passenger seat is not cooled like the drivers.	1
	great car.a better car in all respects to my 06 lincoln ls.	1
	i chose this car over acura, mb, and buicks i test drove.	1
	the car is a deal even at $33k-$37k for the v6 model.	1
	black and silver look great in this car.	1
	no cassette player- this is 2008. i have a 2000 elantra with over 200k miles and it has been problem free.favorite features:looks, price, interior and seats.	1
	leather covered dashsuggested improvements:it needs better advertising	1
	better than i ever thought it could be!.after turning in my lease and getting bait and switched by the dealer on my infiniti g35, i decided to test drive the genesis, as i had followed since seeing the super bowl ad.	1
	all i can say is i am so glad the folks at infiniti bs'd me on the new payment!	1
	i would have missed out on the best vehicle i have ever driven.	1
	everything from top to bottom is so well done.	1
	if this is hyundai's first attempt at a luxury vehicle, i can wait to see what they come up with next.	1
	this is a $60-70k car with a $35k price tag!favorite features:interior is unreal.	1
	sound system (lexicon) great as well.	1
	love the look and the illumination at night.suggested improvements:standard nav maybe?	1
	nothing else.	1
	hyundai won this battle..i bought my car a couple days ago and i can tell you that this a nice car, i compared this car with the lexus gs 350 and the infiniti g35 and the handling, ride and quietness of this car is superior.favorite features:quality, room, finishsuggested improvements:back sensor with the prem.	1
	+ pkg	1
	awesome ride.i've owned bmw and lexus-my genesis 3.8l is more comfortable and has a firm, quiet, comfortable ride.	1
	plenty of power but great mileage for a 3.8l.	1
	i couldn't be happier-i've researched and waited for this car since i saw it on the super bowl ads.	1
	look out lexus-here comes genesis.favorite features:great exterior styling and luxurious interior with lots of room.suggested improvements:folding rear seats.	1
	genesis rocks!.drove the car for the first time yesterday and all i can say is wow!	1
	never thought driving a hyundai could be so fun or engaging yet so relaxing and assuring.	1
	feels more secure than any bmw i've ever driven definitely more on par with an a8 as far as structural feel.	1
	in performance driving the car has such a neutral feeling and is very balanced weather on or off the accelerator.	1
	i don't think the esp even tried to keep the car in line it just did it on it's own.	1
	this car looks great with tight wheel well gaps (looks like it's already lowered) and sharp tight body lines.	1
	the only thing i might change is the rear tail lamps so it looks less like an infiniti.favorite features:technology packages is really cool don't think the car would be quite as impressive without that.	1
	love the usb port and ipod connectivity in the center console.	1
	this car drives perfect in my eyes if you need more power i am sure the v8 will be plenty for most anyone as i am satisfied with the v6.suggested improvements:i haven't figured out if it can play music over the blue tooth connection yet, in the winter i think headlamp washers might be helpful for us in climate zones that see bad weather.	1
	i hope that the dis system can get updated software to keep up to date with new technology.	1
	hyundai has hit a 10!.i previously was the owner of a 2006 hyundai azera which i traded in for the 2009 hyundai genesis w/tech pkg.	1
	absolutely the best bang for you buck on the market today.	1
	this car has lived up to the hype.	1
	this car is definitely 7 series size, 5 series performance, 3 series price!favorite features:bluetooth, hid adaptive headlights, heated and cooled seats, navigation system, led taillights, lexicon 17 spkr surround sound system, ride, quality, quietness, composuresuggested improvements:not much that's needed on this car.	1
	best hyundai.just took delivery on july 15th.	1
	it's a nice car.	1
	good looks and ride.	1
	nice features.	1
	i average 23mpg mixed driving.	1
	the car has a nice exterior design.	1
	inside is kinda boring.	1
	get the lexicon sound system.	1
	you'll love it (i know i do).	1
	however, the cd changer had to be replaced (stopped working).	1
	the service department is not up to par with other luxury dealers (especially bmw).	1
	loaners are nice when your car is in the shop for a day (the shuttle vans don't cut it).	1
	and for the amount of time i own a car (usually 3 yrs) bmw still has the best warranty.	1
	love the standard maintenance warranty (4yr 50k).	1
	at the end of the day this is still just a hyundai.	1
	but, overall i'm happy with the car.favorite features:sound systemsuggested improvements:navi missing some features the other luxos have.	1
	better cabin.	1
	it's a little bland.	1
	and how about a front passenger cooled seat as well (and rear heated seats).	1
	don't skimp.	1
	giant killer.what a great car!!	1
	makes you totally rethink the brand.	1
	the interior is a lot lot better than what the pics show in the web or in magazines.	1
	the fit and finish is very good and the lexicon really is amazing!!	1
	i thought the steering would feel too light as a lot of bigger luxury cars tend to be, but i was pleasantly surprised...it's no sports sedan in feel but it has a good amount of resistance and good on center feel.	1
	only gripe is the bluetooth, no wheel mounted controls and does not come through the cars existing speakers.	1
	go test drive one with an open mind and you will soon forget all that you thought was a hyundai.	1
	i give it an a.favorite features:good overall looks inside and out.	1
	very comfy and roomy interior.	1
	lexicon sound system.	1
	good looking wheels for a luxury sedan.	1
	rear wheel drive.	1
	value.suggested improvements:bluetooth...no steering wheel mounted controls and does not come through audio system speakers.	1
	change the brand to genesis, hyundai name still carries too much negative baggage.	1
	seven series killer.believe it or not i once believed that hyundai was an inferior brand, after buying my genesis and driving the car for the last week i must say that anyone in the large performance luxury market would be foolish not to buy this car every aspect of this automobile screams luxury from the twelve way power seat to the throaty almost three hundred horsepower v-6 i have owned a diverse selection of luxury cars and i have to say i have never been more impressed with a vehicle.	1
	i am also surprised how many people break their neck looking at the car if you are considering a new luxury car drive all others first and then drive the genesis.	1
	better yet just drive it first then take it homefavorite features:stunning european designsuggested improvements:no complaints here	1
	hyundai genesis.ride is busy.. reflecting a stiffer suspension than the azera.	1
	rear seats do not fold.	1
	no passenger seat memory.	1
	rear leg room limited for a 115 in wheelbase.	1
	interior is nicely finished.	1
	cassette tape player not included.favorite features:compact stylingsuggested improvements:see above	1
	genesis is an excellent car!.the hyundai genesis is an outstanding car and performs very well.	1
	this is a luxury sedan that is powerful, quiet, luxurious, attractive and priced very competitively.	1
	handles very well w/ a sporty ride.	1
	great fuel efficiency for a 3.8l v-6 engine.	1
	the instrumentation is great and the sound system is top of the line.	1
	i compared the mercedes e- class, lexus 350, jaguar xf, infiniti m-35/45 and bmw 5 series before i chose this vehicle.	1
	i think its equal or superior in most aspects, yet was less costly than all of the other vehicles i compared.	1
	great value.	1
	hyundai has a real winner in my opinion!favorite features:styling, instrumentation, sound system, seating comfort, quiet ride, engine performance / power, fuel efficiencysuggested improvements:	1
	unbelievable.this car is truly unreal.	1
	i did all my research, drove all the cars on my list and hands down the genesis blew the competition away.	1
	i am extremely happy with my brand new hyundai!favorite features:quality of materials, transmission, ridesuggested improvements:none at this time.	1
	1st hyundai genesis.today i got the new genesis, the first one sold in the u.s according to the factory the dealership got them from.	1
	the interior is as awesome as promised.	1
	i am 6'3' and my 6'2' son fits behind me with plenty of room.	1
	i got the premium plus package and everything is awesome.	1
	black on black with metallic paint, and i am happy to say that it will be possible to debadge the car.	1
	like i said the interior is spacious and comfortable with plush leather.	1
	xm and bluetooth and 6-disc changer, the 14 speaker lexicon system is awesome.favorite features:xm, size, speaker's, looks, bluetoothsuggested improvements:more cars, only 10 max will be sold per dealership this year, but that just means the car will remain very exclusive for the next year or so	1
	2009 genesis review.this is a great looking car.	1
	i got lots of compliments.	1
	but the car simply has the worst ride of any vehicle i've owned.	1
	my toyota camry rides way better.	1
	i'm going for the second time to the dealer to see if anything can be done, but i'm not confident.	1
	i can't see myself driving this car for three years-i'd get rid of it tomorrow if i could.	1
	very, very disappointing.favorite features:looks.suggested improvements:fix the suspension.	1
	apparently there are quite a few people out there who have the same problem.	1
	satisfied with purchase.so far, so good with the car.	1
	i didn't really know what to expect with a korean brand car.	1
	but the genesis has proven itself capable to me.	1
	the car is very beautiful, a little derivative.	1
	but most people think that it is a mercedes, which is a compliment.	1
	the dealership where i purchased it was definitely an interesting experience.	1
	some of the team members were a bit oblivious to the features of the 3.8. but i finally got a guy to help me out with some important questions.	1
	financing the car was good.	1
	got it for about 424/month with 1.9 apr.favorite features:sound system is a plus.	1
	leather dash is very pleasant to live in while driving.	1
	the back seats are extremely roomy for the kids.	1
	the kids are now spoiled and act like business clients.	1
	really, really safe.	1
	8 airbags and that 5 star safety rating.suggested improvements:extra cup-holders would be a nice adjustment.	1
	women need to be accounted for.	1
	like, more storage cubbies for make-up and people stuff.	1
	more cuteness in the interior.	1
	it's nice but.i have owned a lexus ls 430 for six years.	1
	when i test drove and purchased the genesis 4.6, it was compared to lexus and bmw.	1
	my genesis has several little problems that my dealer claims is on all the genesis cars and they can't fix them.	1
	plus the programming of many of the car's functions leaves alot to be desired.	1
	i agree the the car has excellent performance but a car that frustrates you every time you drive it is not a pleasure.	1
	perhaps i expect too much by thinking that a $40,000 auto should have all the bugs worked out before it is put on the market but i don't think so.	1
	perhaps i am spoiled by lexus but relatively speaking, this car does not meet my expectations of $40,000 carfavorite features:the power and pickup is great and the braking in excellent.	1
	the back up camera is excellent on the large gps screen.suggested improvements:fix the bugs and get the fixes to the dealers.	1
	improve the defrost function.	1
	reprogram the computer to get rid of all the stupid things the car does.	1
	don't put a car on the market until the programming is complete and bug free.	1
	after 40,000 miles.i am not sure how many drivers have reached 40,000 miles with the genesis, but i have.	1
	i driven it at speeds of 100+ miles per hour a few times and taken alot of long distant trips without a problem.	1
	this car really performs well in curves, it makes you sit back an enjoy the ride.	1
	i have added 20in tires and rims which has added alittle road noise.	1
	my only fault with the car is, i should have two in my driveway...hooha!	1
	!favorite features:stereo system, drivers seat, and the stance (look from the front)suggested improvements:a chrome lower front grill.	1
	outstanding car.hyundai has done just about everything right on the genesis.	1
	there have been complaints about the ride.	1
	i find that tire pressure is the problem (and maybe the dunlop tire as well).	1
	the techs at the dealer or tire store will put the tire pressure up to 35 psi.	1
	this will produce a rough ride.	1
	if you reduce the pressure to 32-33 psi, the ride will be about like a mercedes e class.	1
	i find this to be about right.	1
	30 psi would be even better but the low tire pressure system will signal low tire pressure if it gets below 30 and you have to run it up to 35 to reset the system and get the low pressure message off.	1
	buy a good tire pressure gage and set the pressure yourself.favorite features:looks, power, 6 speed auto transsuggested improvements:could use more cup holders.	1
	16 months of fun and satisfaction.yes, people make faces: 'a hyundai?'	1
	but i did four months of research and bought it for the value and haven't regretted it yet.	1
	i also got lucky to have the wings on the trunk.this car kept every promise from riding comfort,road handling, to exceptional sound, and all the electronics are working very well with the small navigation button.	1
	i had mercedes and still have a bmw; genesis compares extremely well.	1
	you have to go into bmw 700 category and the 550 mercedes class, which will cost accordingly.	1
	and yes i had more than a dozen people ask me if it is a bentley (because of the wings in the back).favorite features:style, ride, and comfort in driving, listening to lexicon, and the way the car is put together.	1
	the many electronic extras that are standard with the tech package.	1
	acceleration is incredible and beats lexus gs 450 and vw gti (of course we tested it).suggested improvements:25 mpg is it, not bad but of course they claim 25 to 30. otherwise i couldn't think of anything for $40 k out the door with everything.	1
	the best car i have ever owned!i also own a lexus and a benz.	1
	this car is better than both.	1
	i would match this car with any car on the market that costs between 30k and 50k.	1
	i have own my genesis for over a year and have had no issues with it.	1
	it beats both my lexus and benz hands down.	1
	benz imo is over rated; i have had nothing but expensive problems with it since i purchased it new.	1
	the lexus was an excellent car, but it is the little things that get too you.favorite features:design and performance; and very inexpensive to operate compared to either my benz or my lexus.suggested improvements:higher gauge metal body!	1
	best performance-value ratio.after four months of ownership, i am extremely pleased with the car.	1
	the feel and comfort of the car are excellent.	1
	the highway ride and acceleration are super.	1
	the overall quality matches or surpasses that of most luxury sedans on the market -- except that genesis costs thousands of dollars less.	1
	looks great inside and out.	1
	easily, one of the top 'performance - value' vehicles on the road.favorite features:stereo system, smooth and powerful acceleration, design (interior and exterior).suggested improvements:improve gas mileage(incorporate green technology) -- luxury vehicles can be environmentally friendly.	1
	(still not bad for a car of this size.)	1
	some may prefer a 'softer' ride.	1
	love this car...after 9 months of ownership, i have found this car to be everything promised.	1
	the interior and exterior styling are suburb.	1
	i have experienced no mechanical or other type problems.	1
	the car is very comfortable on long trips, although i sometimes prefer a cushier ride to the more stiff sport suspension on this vehicle.	1
	my only 2 complaints are the lexicon sound system is not as good as it is cracked up to be in my opinion and the blue tooth interface is not as compatible as it claims to be with certain phone models.	1
	nonethless, i receive weekly compliments on the car and believe it is one of the best values on the market today.favorite features:exterior styling, performance, gas milage, tire pressure monitoring system, and the xm radio.suggested improvements:more storage compartment space in the cabin.	1
	5 days of ownership and loving it!	1
	!wonderful car, i'm very happy with my purchase.	1
	makes it seem like a waste to purchase a bmw, mercedes, lexus or infiniti for thousands more!	1
	i have the genesis badge/wing on the trunk, and people ask me is that a 'bentley'.	1
	looks and performs stride for stride with the premium luxury automobiles mentioned before.	1
	well worth the $42k..bmw 550 will perform better but at a $25,000 premium.	1
	one of my co- workers owns one, and it is not worth the extra $$$.	1
	i took him for a ride in the genesis, and he couldn't believe it was a hyundai and the price i paid for it!favorite features:the ride, style, interior & exterior, cost, electronics, pretty much the whole genesis experience...suggested improvements:have the germans build a steering columns for the genesis...german cars you just 'point and go'...new 2010 equipment (electronic parking brake, auto cruise, etc.)	1
	should have been included in the 2009 models..include air cooled passenger seat..include genesis emblems for wheels, rear, front grille..	1
	what an amazing value!after much research and test driving i bought the genesis 4.6 with tech package.	1
	i was a bit hesitant because the ride was a bit more firm and sporty than what i was used to with my avalon.	1
	after 2 months, i have to say the ride is no longer an issue and i prefer the suspension in the genesis to my 'couch on wheel' ride i had before.	1
	i still can't believe i paid $36.7k plus t&t.	1
	it's just silly to think people pay $50 and $60k for comparable vehicles.	1
	i also got the wing emblems on wheels, trunk and steering wheel.	1
	it looks fantastic and i've received many stares and compliments on the car.	1
	the es350 was the only other alternative, but it is much smaller and has a dated interior.favorite features:the electronics in this car are fantastic - great response time on the nav, xm and all other features.	1
	it plays mp3's from a usb stick - no ipod required.	1
