	bad electrical system.started having electrical problems within four months.	1
	battery completely dicharges if vehicle is not used for 72 hours.	1
	dealership has replaced battery numerous times and they can not figure out the problem.	1
	changecd the radio/cd head unit for malfunction.replaced the central console for malfunction.	1
	seats are too small and stiff.	1
	front passenger seat has very few adjustments.	1
	air conditioning is not adequate for hot weather particularly when using in auto mode.	1
	cd functions are limited.	1
	cd does not change automatically from one disc to the next.	1
	the data stored in the memory, like phone numbers etc., are lost if you disconect the battery.favorite features:power, speed, handling.exterior stylingsuggested improvements:front seats and out side mirrors need to be improved.	1
	seats are too stiff.	1
	auto folding outside mirrors.suspension needs to be slightly softer	1
	6 month review of my genesis.see my original review ' instant classic' on 04/21/09.	1
	i've now own my genesis 3.8 tech for nearly 6 months.	1
	no problems so far, fit, finish, ride remains top notch.	1
	the exterior design is even better than first thought while the mileage slightly less (lots of city driving) than before.	1
	the integrated bluetooth is used extensively and all autos should have them for safety in today's cell phone culture.	1
	the navigation even easier to use once you know all the short cuts i've had no problems with the suspension and the ride remains a nice balance between soft and hard.	1
	never a day goes by that someone takes a noticeable interest in my genesis, this automobile is special!!!!	1
	!favorite features:lexicon 7.1 dvd sound system.	1
	hd/xm radio.	1
	incredible night vision with adaptive headlights.	1
	interior design remains impressive.	1
	the interface has been outstanding (bluetooth, voice command etc.)	1
	cooled front driver seat and the a/c is impressive (live in s. florida).	1
	still quiet, quiet, quiet!!!	1
	!suggested improvements:cool the front passenger seat.	1
	the dvd will soon be allowed to play during driving for passengers (tech as already been developed for this).	1
	make genesis a sub luxury brand.	1
	all genesis should be sold with wings on hood, trunk and wheels.	1
	this makes the genesis stand out by itself.	1
	pleasant surprise.i was looking into buy a new car.	1
	i considered the genesis brand.	1
	i changed the badge and i am happy with the car.	1
	it moves well and is comfortable.	1
	hopefully, the car will last me for quite a while.	1
	i like the back lit controls at night.	1
	really cool to drive infavorite features:engine displacement and handling.	1
	i feel very confident on the road.	1
	highway driving is really fun actually with this carsuggested improvements:the rims are a little plain.	1
	i suggest a better designed rim, though the rim quality is high.	1
	i like five pointed spokes.	1
	great car.after 6 months of research i bought it.	1
	has tech pkg.	1
	quite, solid, fast, head turner, comfort.	1
	i have no complaints about the ride.people has mistaken it for a mb, lexus, bentley.	1
	would be nice if the cd player was also a automatic changer.	1
	but the xm is great.favorite features:tech pkg.,xm, seats, style.suggested improvements:cd to be auto changer, sun visor extenders.	1
	genesis - truly a beginning.incredible experience!	1
	speed/power, luxury and incredible soundsystem.	1
	did i mention how fast it is?	1
	looked at lexus gs350 but have no regrets.	1
	car is a real head-turner.favorite features:power, luxury, audio/nav system, styling.	1
	the ride is excellent, handles extreme;y well in tight spots.suggested improvements:retractable side mirrors control, lighted home control buttons, ability to see phone book in bluetooth, remote start	1
	needs much improvement.need hand grips on under side of steering wheel.	1
	no timer for front or rear defrosters.	1
	sunlight washes out nav screen and rear back up camera.	1
	need larger sun visors with side extenders.	1
	windshield washers only spray lower windshield.	1
	limited warranty on all electronic items.	1
	bad blind area when drivers seat is all the way back.	1
	need light under hood.	1
	rear mud guards are to small.	1
	both front seats need the same features and more thigh support.favorite features:push button starter.smooth flow of power.	1
	rear sun shade.	1
	nav system.	1
	good gas mileage.sound system.suggested improvements:use better tires dunlops are rough and hard to balance.	1
	easier steering.	1
	rides like a truck.	1
	typical hyundai, genius.no complaints whatsoever.	1
	i'm kind of a person that likes to buy based on value.	1
	of course, hyundai was the ticket.	1
	though, i was a bit skeptical about the hyundai brand, the genesis shattered my perceptions about the brand.	1
	i can not say how classy the car remains even after a few months of ownership.	1
	put a genesis badge and the car is not that much different from a bentley imo.favorite features:steering wheel has a nice soft touch.	1
	the stereo controls are a simple and intuitive.	1
	the amenities galore, wow.suggested improvements:change the badge to something artistic and symmetrical.	1
	though, i get the two people shaking hands thing with the slanted h, most consumers will not get that esoteric art.	1
	rides too rough..i bought my pre-owned 3.8 from a man who is known to be less than frugal who really 'unloaded' this beauty upon me.	1
	it is a gorgeous car, but after i drove it 850 miles it reminds me of the gorgeous, brainy woman who can't boil water.	1
	only the bmw 318i that i just sold rode worse.	1
	the suspension system is horrible.	1
	when the tires are cold you can feel every tar strip in the highway.	1
	the guys who designed the suspension should not be allowed to graduate fro high school this year.	1
	the steering is also numb and it becomes very tiring to be driving with the intent to find a good centerline feel and have that suspension fighting me.	1
	there is too much road noise being transmitted into the car.favorite features:the design statement, interior feels great.suggested improvements:redesign the whole suspension system.	1
	it rides about as bad as the bmw.	1
	the cup holders are too few in number and poorly placed.	1
	it could use a bluetooth that will download my entire address book.	1
	the one in there is a bit low tech.	1
	worth every penny.i got a genesis for my wife's birthday.	1
	she couldn't be happier with the car.	1
	it was a 3.8 l with plenty of luxury accouterments.	1
	she certainly will drive this baby for the next ten years or so.	1
	it is snowy in michigan, can this thing last in snow.	1
	well, the good thing is that the genesis was fitted with winter tires.	1
	hopefully, the rwd architecture will handle the icy conditions.favorite features:navigation is a breeze to go through.	1
	the styling is classical but understated.	1
	the eight airbags and overall safety features is a + for the wife and kids.suggested improvements:the seats are a little too stiff for my liking.	1
	i generally like plush seats, as in my old american cars.	1
	but that complaint is more of a nitpick.	1
	i'd like to download more media files onto the hard disk of the onboard computer.	1
	the dvd player should play when driving.	1
	happy with car.i needed a new car, since i drive pretty often in the new york metropolitan area.	1
	found this beauty of a car.	1
	the 3.6 l v6 with technology.	1
	i can not find a negative quotient or facet where this car lacks.	1
	it's plenty big, plenty strong and comfortable for the long trips down route 80 and i-95.favorite features:steering feel is ver precise for a hyundai.	1
	the sensitivity of the wheel column makes the driving experience much easier.	1
	the back lit nights during long trips make it look very chic.suggested improvements:heated and cooled seats for both passengers is a suggestion of mine.	1
	beginning of a beautiful relationship.you know, things aren't always what they seem.	1
	i've been driving caddy's for a quite a while in my life time.	1
	i'm an ol timer, not too old.	1
	but i gotta say that this vehicle really took me by surprise.	1
	seeing the way how korea has become a modern country.	1
	i can not be surprised to see the level of development in their car manufacturing.	1
	i got this 3.8 for about 37,500 at iowa city.	1
	it is a great deal.	1
	it reminds me of 1988 all over again.favorite features:the general clean and acceptable interface of the car design.	1
	the outside is bent on telling a person that, i am one serious driving machine.	1
	the inside is a place of nice diversion.	1
	where i can listen quietly to high end classical music.suggested improvements:the ride, as some people say is on the stiffer end.	1
	i lowered the pressure on my tires to improve the ride.	1
	i do insist on hyundai to listen to more customer input regarding ride comfort.	1
	it's a great vehicle.got this beauty for 38,000 with the tech package.	1
	i couldn't be any happier.	1
	the thing moves and is very nice to be inside.	1
	looking forward to future hyundai vehicles.	1
	especially the equus.favorite features:the heated and cooled seats: rear window shades: cup holders for back seats: luxo-like ride, especially in the back: 293 bhp: 25 mpg in the highwaysuggested improvements:the style is a little derivative.	1
	i like the mercedes like front grill.	1
	but the back looks too much like a bmw.	1
	get some creative s.korean designers to draw the back end.	1
	this car is a contender.i got this car yesterday after test driving this vehicle.	1
	i certainly can say that the genesis has a one of a kind personality.	1
	though the car feels much more expensive, with luxurious appointments, the price paid was only 41,500 with all the options laid out.favorite features:bluetooth for multi-tasking and a very easy navigation system.	1
	the car is very comfortable.	1
	and, the back-seat drivers feel chauffeured to their way a destination.	1
	the interior size is truly a nice thing to appreciate extremely safe car.suggested improvements:ummm...... maybe i should have waited for the 2010 genesis.	1
	hyundai is developing a state-of-the-art 6 speed transmission which will be butter smooth.	1
	as well, as more fuel efficient.	1
	the break feel can improve a slight touch.	1
	incredible car for the money.have had mine for only 3 weeks but i am loving this car.	1
	i am constantly being stopped in the parking lot to find out what kind of car it is.	1
	it is roomy, powerful, and luxurious.	1
	i drove lexus e350, infiniti m35, bmw 535 and this.	1
	bought the hyundai the next week and have no regrets.	1
	it stands out in the crowd of those cars on the road and is much less expensive.	1
	the ride quality is excellent in my opinion.	1
	i ride normal roads, some good and some bad, but i don't see where people are coming from in saying the ride quality is bad.	1
	this is a helluva car.favorite features:ac seat, rear camera, lexicon sound system is incredible, powerful engine,quick braking, telescoping headlamps.suggested improvements:address book sync for bluetooth enabled phone.	1
	larger cup holders.	1
	homerun of a deal.i got my 3.8 with the technology package and i can not say enough about the car.	1
	i also deflated the tire pressure to improve passenger comfort.	1
	it is interesting to hear people complain about the suspension, when in fact hondas, mazdas, and now fords ride give me a backache every time i drive one.	1
	the dealership experience was solid.	1
	it felt like i was getting a luxury car at a costco.	1
	there was nothing wrong with the dealers at hyundai.	1
	they treated me well, they knew the details about the genesis.	1
	as well, they did not rush me or push me to make a purchase on the hyundai.favorite features:good interior appointments and bluetooth/mp3 integration.	1
	the navigation system is a breeze to use.	1
	and the car is truly spacious.	1
	good handling car with that independent five link suspension.	1
	the doors slam with a solid thud.	1
	as well the car is very well built.suggested improvements:soften the ride a little bit.	1
	the hyundai engineers should figure a way to create a 2 mode suspension system to give the option to customers for a rider's car or a lounge/cruise car.	1
	great all around.you just can't get more car for the buck than the genesis.	1
	i wanted an entry full-size luxury car for a little over $30k, and so my options were limited.	1
	shopped against toyota avalon, a few buick models, ford taurus, even the hyundai azera, and there's no contest here.	1
	of course one can get a used lexus or something, but i wanted a new car, plus hyundai has the great warranty.	1
	and even if i could afford a new lexus es or gs, i'd much rather save the money for gas and go with the no-name genesis.favorite features:ext and int styling.	1
	nothing original, but it's just a good looking car.	1
	also, the engine (v6) is powerful, quiet, and has surprisingly good fuel economy.	1
	also, there's just nothing pretentious about driving a genesis, and i like that.suggested improvements:ride can be a little smoother.	1
	rear- visibility isn't that great, but it seems like the trend these days with smaller windows.	1
	great car..i really love this car.	1
	the price was great.	1
	i got every option you could purchase and it is alot of fun to drive.	1
	the nav system is superior.	1
	i think the nav system is overpriced but worth it for me.	1
	the only complaint i have is about the road noise.	1
	i could really tell the difference between this car and my old car when i went thru the car wash. it was much louder.	1
	my old car was a lincoln ls.	1
	to get a comparable lincoln i would have had to spend about $10,000 more.favorite features:nav system is great and very very easy to learn.	1
	headlights turn with me.	1
	rear camera system.	1
	i have trouble backing up any other car without it.	1
	it is amazing how fast you get use to it.	1
	interior colors get many compliments.	1
	(black and brown) car price was great.suggested improvements:sun visors feel cheap.	1
	less road noise.	1
	everything else is great!	1
	suspension is the problem.i just got my car on aug 6th 2009 (manufactured date: july 7th 2009).	1
	in general, i love this car lots.	1
	only thing that ruins this car is its suspension.	1
	it is fun to drive but it is not comfortable with its crappy suspension design.	1
	the 7-speaker system is good.	1
	and trunk, glove box and handrest box are big but no partition at all.	1
	there is no way to organize the items, quite a mess.	1
	many people starred the car while driving.	1
	and it brings some talks with friends and strangers while parking.	1
	water came into trunk when open.	1
	please and please fix the suspension in all effort for the pioneer (who bought the first year genesis) as the compensation.favorite features:1. hid 2. the look (inside and outside) 3. super quiet, loved it so much (hope no rattles in future) 4. cheap insurance (bcos it is hyundai i guess) 5. good value with this kinda price.suggested improvements:1. hyundai should fire the suspension design team or at least the team lead.	1
	2. backseat cannot be folded 3. water comes into trunk when open (i don't believe it, but yah, what a dump design) 4. back to #1, suspension ruins the whole car comfortability.	1
	a follow up review.a follow up since my last review back in may.	1
	i now have 2500 miles on it and it is still doing just fine.	1
	this piece of advice may help with those complaining about the hard ride, i just spoke with my hyundai service manager about softening up the ride.	1
	he told me that the car comes from the factory with a hard rubber tire, and that if it had a softer rubber tire on it, it would ride better with less bumps.	1
	i'm not complaining, i still have all the luxury, i still have over $25,000 in my pocket vs owning one of those other high end luxury brands,its cheaper maintance, and everyone still walks around the car admiring it.	1
	i'm just waiting on hyundai to appreciate us genesis's ownersfavorite features:everythingsuggested improvements:no passenger cooled seats	1
	incredible driving machine.i love this car.	1
	i was in the market for a bmw 535i (also considered audi a6 and infiniti m35) until test driving the genesis 4.6 with tech package.	1
	power and acceleration are great, delivered smoothly and eagerly.	1
	handling is also very capable considering the large size of the car.	1
	the car is extremely quiet, even with sunroof tilted, making it easy to enjoy the 17-speaker lexicon stereo (with cd/dvd-audio player and mp3/ipod inputs).	1
	fit and finish is excellent, and i really like the clean, intuitive layout and controls.	1
	technology is well integrated and works well (bluetooth, voice recognition, etc.	1
	).favorite features:power and performance, quietness and refinement, fit and finish, lexicon stereo, technology and navigation system, build quality, lots of luxury features (to many to name!	1
	)suggested improvements:a few minor tweaks would make this an even better car: cooled/ventilated seat for passenger (not just driver), address book transfer over bluetooth, and power-folding (not just power tilting) side mirrors.	1
	high hopes now back to bmw.nothing but praise for the first few thousand miles then occasionally starting goes to about 400 rpm and runs rough.	1
	had to shut down.	1
	access steering would run halfway down and would have to manually reposition it.	1
	rear air would intermittently go to full hot (so much the the center console and side of the drvr seat was hot to touch).	1
	these's a tech order out on the heat but the dealer is not allowed to change the part unless they can duplicate the problem.now the 'new' tau engine is knocking for the first few minutes after start indicating a possible internal lubrication problem (dealer not sure if problem).	1
	first start of the day get out and listen.favorite features:nav system ease of operation and ride comfort.	1
	interior fit and finish.	1
	cockpit control locations.	1
	sound system second to none.suggested improvements:get the engineering right before putting on the mardet.	1
	amazing vehicle.i have to admit, i thought i would never buy a hyundai but i just bought one of these and wow, i am amazed by the fit and finish of this car.	1
	i just sold my lexus so i am used to a nice ride but this takes the cake.	1
	the way the car excellerates and handles is very impressive.	1
	i love the quality of this car both in and out.	1
	the controls are very will thought out and every one of them seems to be placed where it needs to be.	1
	i think i am going to enjoy this car for years to come - thank you hyundaifavorite features:it is all in the ride and feel of the car when driving it.	1
	the power of the engine and the quiet ride make this car worth every nickelsuggested improvements:i do have a couple of suggestions for improvement but they are so minor they are almost not worth mentioning.	1
	the passenger seat should be height adjustable.	1
	the front cup holders should be further apart.	1
	there should be a compartment for eyeglasses.	1
	the genesis logo and 6 cd changer on base model.	1
	this car is sick!.hyundai went above and beyond with this car.	1
	too much fun!!!	1
	for the money, there is not a better value on the market, period.	1
	i love the fact that this car is indeed a hyundai, which appeals to a person like myself who wants luxury without the cliche of owning infiniti, mercedes, bmw, etc.	1
	the surprise that comes with the discovery that it's a hyundai is priceless.	1
	i've had a few issues with the afls (adaptive front lighting system) and she was in the shop 3 times in about 2 weeks.	1
	eek!	1
	but that's been the only issue, and considering it's a production model i was expecting a lot worse.	1
	true, it's been less than a month but i don't care, she's here to stay!favorite features:push button start, surround sound, voice activated controls, gps with a yellow pages built into the system so that my car can find my a hotel, restaurant, anything and just take me there; interior, sun roof, auto rear shade, exterior - i love this car!suggested improvements:adaptive cruise control would be a nice perk but overall this is a wonderful car.	1
	would be nice if the phone was able to read text messages aloud (maybe it can and i just haven't discovered it yet...)	1
	very poor suspension.the plain truth about the 2009 genesis is that it has a horrible suspension and rides like an old truck.	1
	you can feel every bump in the road.	1
	i think you could run over a fishing worm and feel it.	1
	this severe defect is not immediately noticeable during a short test drive.	1
	the dealer states that this is designed into the car because it is a high performance automobile.	1
	it is fairly smooth on the interstate but it jitters and bounces over suburban streets.	1
	the ride is the most important element of a car and it fails my expectations.	1
	i'm not alone in my review of the suspension.	1
	read the hyundai genesis web site for more.	1
	the car is a beautiful car in all other aspects it is fantastic.favorite features:the car's quietness, and the pep of the v8 engine are noteworthy.suggested improvements:replace the suspension system.	1
	it will be the downfall of an otherwise fantastic automobile.	1
	it doesn't rate the title of 'north american car of the year' because of its ride.	1
	luxury at a bargain price.i have had my v6 3.8 purchased with all available options for 4 months (7k miles).	1
	i love this car.	1
	i not had any issues and it is a great value.	1
	i am averaging 23 mpg in mixed driving.	1
	my friends with more expensive cars (e- series, lexus ls, etc.)	1
	cannot believe the bargain.	1
	in fact, my boss just traded in his infiniti m45 on a v8 genesis.	1
	claims he saved over $150 per month on his lease and gave up very little in luxury or performance.favorite features:what i like best: - luxurious and roomy interior - the lexicon sound system and the tech package are absolutely awesome.	1
	- the price - quiet ride - the lexicon system (worth repeating- it's that good!suggested improvements:- ability to import phonebook into bluetooth - adaptive cruise control - blind spot monitor - put all features on the passenger seat that come with drivers seat - adjust suspension to reduce bounce at low speeds on uneven roads - improve the dealer experience -not on par with luxury car dealers	1
	a wonderful car.i was looking to replace my old bimmer, and i found a car that looked twice like my own.	1
	i thought it was a new bimmer.	1
	but, to my surprise, it was a hyundai, out of all cars.	1
	that car i saw provoked me to look at the genesis.	1
	i test drove the darn vehicle and i never looked back.	1
	i can say for certain that, like other posters, test driving the genesis is a sure fire way take the hyundai into your garage.favorite features:eerily quiet ride.	1
	i can hear a pin drop on the mat.	1
	the level of strength in the chassis makes it look like tank.	1
	but the surprising revelation is to realize the big genesis is a hauler.	1
	and it can handle like smaller car.	1
	something a bigger car should not be able to do.suggested improvements:i agree with one of the posters here.	1
	some people actually snickered at me, when i told them that it was a korean hyundai.	1
	little do they know that hyundai is a well respected #1 shipbuilding manufacturer.	1
	soon they will climb in the automotive field as well.	1
	change the luxury marque.	1
	amazing value!.less expensive and more fun to drive than a lexus gs350.	1
	eye-catching styling, great ride, and roomy interior, both front and rear.	1
	shouts 'quality!	1
	'favorite features:gps and sound system.suggested improvements:air-condition front passenger seat and add motorized back-up mirrors and programmable front passenger seat.	1
	this car is exceptional!!!	1
	!.i bought this car the day after my birthday in april.	1
	i absolutely love this car!!	1
	it is the best kept secret.	1
	most people think that mercedes,lexus and bmw are the best, but 'no'!	1
	this car out rides and performs these cars and other luxury cars for less than their prices for sure!	1
	i have the 6 cyl and the black on black.	1
	i love the lexicon sound system and the comfort and quiet cabin.	1
	i am having the wings put on and drive everyone crazy!	1
	i get alot of stares now while driving.	1
	everyone should at least test drive it!	1
	you will not be sorry!	1
	check it out!!	1
	!favorite features:the push botton start,the soft leather seats,the interior design,the outside smooth lines design and so much for the $$$$$$$suggested improvements:maybe a fold down rear seat!	1
	beautiful girl, bad personality.this car appears beautifully built and superbly appointed.	1
	it looks and feels like a $70,000 car for half the price.	1
	it exudes class and the fit and finish and appointments compete with the best in the industry.	1
	the dark secret is that it has horrible suspension and rides like a truck.	1
	this severe defect is not immediately noticeable - the suspension has a dual personality.	1
	it is beautifully smooth on the interstate but it jitters and bounces over suburban streets.	1
	it is horrible to drive and i regret leasing it.	1
	i am deeply disappointed.	1
	a short test drive doesn't reveal the quirky suspension characteristics.	1
	'this beautiful girl has a bad personality'.	1
	beauty is more than skin deep.favorite features:everything!	1
	the way it looks, interior appointments, fit and finish, lots of features, lots of room and peppy performance with the refined v6 although it could have a more sensitive throttle.	1
