	however, sometimes the screen becomes blank.	1
	in this case, i cannot tell whether the machine is shut down unwantedly, or it fails to show an image.	1
	2) sometimes, sliding the power switch and holding it for a few seconds (definitely less than the time needed to reboot the machine) reboots the machine, instead of shutting it down.	1
	3) i read a txt book in utf-8 encoding.	1
	i found that there were 3-4 places where text (about several hundred words) was missing.	1
	i promise that those were very common characters (ascii english letters, digits, punctuations), and they did appear in the txt file when i opened it in microsoft notepad / gvim / ... anything else.	1
	despite of all these, i think the kindle dx is very good.	1
	the e-ink screen is comfortable for my eyes; the dictionary is very convenient.	1
	i wish somebody in amazon could let me know how to fix these issues.	1
	that would make the kindle dx perfect.	1
	my kindle dx.this is absolutely wonderful and better than i could have ever imagined.	1
	it's so simple to use and it is so lightweight.	1
	i love the fact that i don't have to hold it while i read - i can just set it on my lap or a pillow and i only have to push the button to turn the page.	1
	this is fantastic and my husband loves it too.	1
	he likes the fact that he can get newpapers downloaded to it.	1
	this was absolutely one of our best electronic purchases ever!      	1
	my new best friend..my kindle is my favorite and best friend.	1
	during the past summer, i ordered and read several samples of books and then ordered the books as well.	1
	it is so simple and convenient, i think i read 12 books on kindle this summer.	1
	since i lead book discussion groups, underlining is essential to me and it was easy to do.      	1
	had my doubts but happy now.	1
	wonderful.i recently received my kindle dx as a graduation gift, and continue to be surprised at the convenience of this product.	1
	the size and weight are both easily manageable, especially when compared to that of a few books, which i would generally be carrying while traveling.	1
	i do wish it came with a backlight option, as it can be difficult to read in low light.	1
	overall it is very impressive.        	1
	kindle dx.i am in love with this device.	1
	i love to read.	1
	the problem is that i have to carry heavy books everywhere.	1
	now i don't have this problem anymore.	1
	i was also able to buy some medical references and carry my kindle with me avoiding the bulky books.my husband gave me the kindle dx for my birthday.	1
	it has been one of the best presents that i have received.	1
	thanks       	1
	enjoyment.	1
	excellent for reading while in bed..have had this kindl for just over one month.	1
	haven't really had it long enough time for a meaningful review.	1
	so far have found it to be a wonderful assist for people who like, or must, read in bed.	1
	if i could find the answer in the users guide, it would please me to be able to lock the horizontal or vertical aspects in place.      	1
	my kindle.i have had mine for about a month.	1
	i love to read.	1
	the first two weeks i didn't watch tv or do any of my crafts all i did was read.	1
	i believe i have 20 or so books now and with the exception of a few that i can't seem to get interested in i have read them all and enjoy them.	1
	i do recommend if you want to purchase and download to your kindle do it direct from the kindle not from the computer to the kindle it is much slower.	1
	i love my kindle.      	1
	you may want to consider-.i have had the dx for a bit over a month.	1
	today is the first day i do not have it with me.	1
	forgot it at home!	1
	i have to say that it is an amazing piece of technology.	1
	i like the ability to download reading materials almost instantaneously.	1
	i like getting the newspapers daily, although i am still trying to find one i want to keep.	1
	i did not have a kindle previously.	1
	my main problem with the kindle is organization.	1
	as i said, 30 days and i already have 3-4 pages of titles to scroll through to find what i am looking for.	1
	it does leave most recently read items at the top of the list, but i would like a folder system that would organize all subject onto one page.	1
	then open 'newspapers' or whatever names i select, and then find the item.	1
	as it is, every time i open the kindle it is like i have just picked up 20 books, periodicals, or newspapers and i have to sort through them to find what i want to read.	1
	does that make sense?	1
	it is distracting.	1
	i would also add that i do miss paper books.	1
	i have yet to find out how the airlines treat an electronic book.	1
	i may have to take a paperback along for the first and last 20 minutes.	1
	in closing, it is novel, a bit amazing, i like the dictionary, but for me, it just doesn't offer the same experience as a book in hand.	1
	i will keep using it, but will also read the real thing at every opportunity.      	1
	renewed desire to read.i seldom read, however after purchasing the kindle dx 9.7' latest generation for my wife i downloaded a book and read it cover to cover before my wife ever got a chance to use it.	1
	i've even decided to purchase another just so both of us can read at the same time.	1
	pros, screen not back lit makes it easy on the eyes.	1
	type size is adjustable for baby boomers in the transition between single vision and bifocal eye wear.	1
	light and portable allows for taking reading material anywhere, train, plane, waiting rooms.	1
	audio option great for bi-sensory input.	1
	hugh selection of reading material and affordable prices.	1
	grownup children can't raid our collection of books, never to be returned.	1
	cons, initial cost, but savings on purchases easily outweigh that issue.	1
	warranty could be improved.	1
	all in all a pleasurable high tech way to enjoy the low tech activity of reading.       	1
	kindle dx review.kindle dx is a great way to read a book.	1
	i love the large print, ease of carrying and holding.	1
	reads great in bright sun.	1
	i also appreciate the ease of reviewing books and reading what others have to say at the kindle store, before making my purchase.	1
	truly a breakthrough in reading.	1
	it will be interesting to watch its future as authors and publishers rethink the book distribution cycle.	1
	amazon is redifing the cost of a book.	1
	why pay more than $9.99 for any book?      	1
	kindle dx.love it!	1
	i like the larger format, the easy to read text...and how convenient it is to have definitions available on the same page as i read!	1
	the good part:  i can have a whole library in this thin, light-weight ebook, including reference books, novels, cookbooks, magazines, and newspapers.	1
	i can read for several hours on a single charge, and it automatically 'keeps my place' when i interupt my reading.	1
	it's very convenient to travel with, too.	1
	i love my kindle dx!      	1
	new dx user.bought the dx for my husband to take on the road when he travels and it hasn't left the house yet!!	1
	new to the kindle family, first purchase.	1
	chose the dx due to it's screen size...love it...since i haven't owned a kindle before the lack of next page button on the left side is not an issue for us.       	1
	the future is now.although pricey, the kindle dx exceeds anything similar on the current market.	1
	the light weight, easy to read electronic book allows you to not only carry dozens of full text books, but also, with low price subscriptions, obtain immediate news updates, magazines and blogs.carry the kindle dx eliminates 'dull moments' or 'down time' found throughout the day of daily activities.	1
	and for travel, it is perfect for planes, trains and automobiles (if you are not driving).      	1
	kindle dx.	1
	i love the kindle dx!	1
	i took it on vacation and read in the plane and near the pool.	1
	i'm too stubborn for bifocals so i really enjoy the larger print.	1
	i love the built-in dictionary.	1
	the ease of reading multiple books and articles with built in memory of where you left off reading is pretty handy.	1
	amazon has a good selection of books to select for the kindle.	1
	the optional male/female audible feature is also nice.        	1
	can't stop reading!.love the kindle dx.	1
	it makes reading so fast and easy, i think i will go broke buying books for it!	1
	the characters are crisp but not too much contrast and i love the size of the screen.	1
	the only downside for me is the lack of a page turning button on the left side of the screen, but the positives far outweigh this little flaw.	1
	i will just have to learn to drink my coffee left handed or put the cup down to turn a page.	1
	my husband has the first kindle and he loves his, too.	1
	we kept them on the same account so we can read books on either one.	1
	that is a nice feature!	1
	thanks, amazon!	1
	!      	1
	kindle dx: ok.the device is quite good.	1
	i have not used an ereader before and find reading this screen surprising pleasant.	1
	not paper-white, more a shade of grey, but you get used to that.	1
	clicking next page perhaps a little stiff.	1
	very strange that you cannot organize your downloaded library into folders.	1
	resizing font is excellent.	1
	cannot resize pdf displays of course.	1
	i use this mostly out of the us.	1
	i do not use the 'whispernet' feature due to non-us billing which i will not 'fix' just for this service.	1
	non-whispernet users are second class citizens.	1
	mobi or azw books of recent publication date not easily found except through amazon.	1
	even free kindle books via amazon not available for download unless billing information is us-based.	1
	pathetic.	1
	conclusion: a nice reading device, too expensive, pity about the amazon strangle-hold, but you should expect that when a bookseller sells a book reading device.	1
	will sell when something better, open, and global comes along.	1
	in the meantime my kindle is a repository for the oldies but goodies.      	1
	love it!!	1
	!.absolutely love my kindle.	1
	very easy on the eyes.	1
	battery only lasts me about 3 days but then again i read all day and night, so it's understandable.	1
	bigger screen is great.	1
	i would definitely recommend it to anyone.      	1
	amazing.love my kindle dx, it is even better that i imagined.	1
	the only problem with it is that i dont get to use it as much as i would like because my wife is always stealing it and reading her romance novels on it.	1
	at least i wont have a problem figuring out what to get her for christmas.      	1
	hardcover lover converts to kindle dx !.i originally pre-ordered the kindle dx for my husband who is a voracious popular fiction reader.	1
	he always likes to get the newest releases and often runs through 2 to 5 books he has purchased at sam's club, etc.	1
	for $15 to $25 in hardback (which he prefers) when at the beach on weekends.	1
	he dismissed the kindle dx before seeing it because 'he likes the feel of a book in his hands'.	1
	so i began to acquire several books and magazines i am interested in, and began to enjoy the kindle dx experience.	1
	over the long weekend of the 4th, he once again found himself without a new read and with no local bookstore available.	1
	i downloaded a new one for $9.99 and encouraged him try it out.	1
	he was instantly hooked!	1
	i had also purchased the leather cover so he might like it better.	1
	it really wasn't necessary, although i like the protection it provides.	1
	as soon as the color one comes out, i'll be getting one and handing this one off to him.	1
	hope that will be soon so we aren't fighting over this one!	1
	i also bought a 'sleeve' so it worked great on the beach without sand and water worries!	1
	we love our kindle-dx !      	1
	everything i expected it to be!.i an early adopter of the new kindle dx.	1
	this is new territory for me as i usually let a product be on the market for awhile before stepping in, but it was my 50th  birthday,i wanted to rediscover my passion for reading and decided to go for the larger format of the kindle dx.	1
	the kindle dx is performing exactly as expected.	1
	the screen is crystal clear and i have found the ability to modify the fonts very convenient as i like the larger fonts at night when my eyes are tired, but the smaller fonts other times.	1
	the ability to order books is as easy as amazon says it is.	1
	a couple of clicks and 60 seconds later the book is ready to read.	1
	personally, i peruse books using my computer on the website easier and faster, as i like to navigate more as i look for titles.	1
	the devices ability to rotate was more useful than i realized it would be.	1
	in particular, i find myself reading upside down to put the next page key on the left-side when i'm snuggled with my wife watching television.	1
	also, as a do a lot of reading and research while i travel, the ability to download pdf documents a real plus and the elimination of a few pounds of material is good news for my shoulders.	1
	the battery life is excellent and with the wireless turned off, i easily get more than a week of usage (i've haven't pushed the battery life beyond 10 days yet with the wireless off).	1
	things to note are that not all newspapers / magazines are created equal.	1
	it is worth your time to read the reviews and try them them before you buy.	1
	as publishers tailor their content for this medium, the quality should go up.	1
	the 'blink' when you go from one page to the next took me about an hour to get used to.	1
	now, i don't even notice it.	1
	finally, this is a device designed for 'readers.'	1
	if you are looking for quality pictures or high-end graphics the kindle dx is not for you!	1
	overall, highly recommended!      	1
	kindle dx exceeds expectations!.	1
	what i would like next.i have owned and used my kindle dx for a couple of weeks and find it is everything promised.	1
	the ability to change orientation at will makes it very easy to use under all reading situations.	1
	the consumption of power is very light, especially when not using the wireless.	1
	as a user of the iphone i find the synching of the two to be a terrific bonus as i find myself reading when i am waiting at restaurants, repair shops etc.	1
	without the need to carry my 'big' reader with me.	1
	since i use the iphone, i did find initially i was always trying to 'touch' the screen instead of using the multi-function control.	1
	although i have overcome this, i still would like to see this added to the functionality of the kindle.	1
	the larger screen for me makes it feel and look exactly like the hard covers i previously read.	1
	the ability to order up virtually what ever i want to read is an outstanding feature of all the kindle's.	1
	if you want the above conveniences, get one!       	1
	better than i thought.this is my first kindle.	1
	my husband bought it for me.	1
	i love it!	1
	it's bigger than i thought it would be, but i like it.	1
	some have said its too heavy to read in bed, but i've found that's not true for me.	1
	it's much easier and more comfortable.	1
	my hands would get tired trying to keep the books open, and trying to balance the heavier hardcover books in one hand for page turns.	1
	the kindle is more relaxing.	1
	i find it about as heavy as a magazine.	1
	the display is beautiful, i've never seen a kindle before (other than pics online) and i have to say i've never seen anything like it!	1
	it looks like a page from a book in a white frame.	1
	it looks so real that the first book i started reading i tried to turn the page like a paper book lol... i did that a few times.	1
	i find the keyboard keys work good.	1
	i have to put the kindle down to type because it's easier for me to reach all the letters.	1
	but, i have very small hands.	1
	when i put it down i can type just fine.	1
	if you have a cellphone with a keyboard, and can type on it, you can type on the kindle without much problem.	1
	i get my books in less than 60 sec.	1
	i live in a basement apartment and our cellphones sometimes have trouble getting a good signal, so i thought the kindle would be the same way.	1
	i did check the map to see if we had coverage where i live, and we do.	1
	the kindle works better than our cell phones!	1
	i get full bars... i never thought i would, i thought i would have to go outside to order books and whatnot.	1
	i am also impressed with the web browser, it is slow compared to your high speed connection, but fast for a mobile device.	1
	i don't have the web on my cellphone, so its nice to have that access anywhere anytime and for free!	1
	i can't think of much that could make it better, there are a few things, folders to organized books n things, there is a back button, but i would like to have a forward button because sometimes the back button takes you back to where you don't want to go.	1
	and... although i know the technology isn't ready yet... color would put this way over the top.	1
	anyone who loves to read, would love to have this kindle.	1
	i would also recommend a case to put it in.	1
	i didn't want to spend a lot on the case so i made my own.	1
	i took apart an old binder, took the cover and back of it, cut it down, covered in fabric and added elastic to hold it in place.	1
	i made it to pass the time, started it the day i ordered the kindle and finished it the day it was delivered... kept my hands busy!      	1
	a dramatic improvement.i have owned all three kindles now and believe there has been a wonderful evolution from a interesting concept to a powerful tool with great potential to change reading across the world.	1
	the kindle 2 was a step up over the original kindle, but the dx is a transformational change that brings textbook and business use into the realm of possibility.	1
	the size of the dx, its much improved button placement and the ability to use pdf files moves the kindle from a reading toy to full fledged reading tool.	1
	the challenge now is for amazon to convince america's textbook publishers that they have a system that can protect publishing rights.	1
	when they do a whole new world will be open to our students.      	1
	nice but for the price....	1
	i love it.well i just bought an amazon kindle dx and i am so happy with it!	1
	it is everything i wanted and more.	1
	the pdf support is wonderful, and the huge screen is amazing.	1
	i must give my thanks to: http://amazon-kindle-dx-review.com/ their review really helped me in the buying process... thanks!      	1
	the kindle dx makes reading easy and more fun than ever.	1
	this is a holdup!.mykindel dx is more than i imagined.	1
	after having a stroke, my ability to hold books with two hands is limited.	1
	one hand operation has provided more control and much faster reading.	1
	reading in bed is again possible.it's great to have that green feeling with the knowledge of saving trees.      	1
	amazon should cut the price down.today is my 5th day with my kindle dx.	1
	i am a grad student who need to read lots pdf journal papers.	1
	i like the screen size of dx which really makes me comfortable to read by clean words.	1
	it does heavier while i hold it in one hand.	1
	though it weighs like iphone 3g but the big size keeps you hard to hold it for a long time reading.	1
	wireless download and the screensaver are two of the sweet features in dx.	1
	i do wish amazon could let user set up their own custom screensaver.	1
	and let us upload images and doc files via usb not the wireless conversion.	1
	and i have to say that i am really disappointed about the pdf reader.	1
	amazon provide the native pdf support in dx but w/o the most important annotation and zoom in/out features.	1
	now, look at the machine i got:  it can read the books only on itself, and plus a pdf reader which cannot do anything but rotate the screen(fine, you can do some searching keywords).	1
	how could you claim the kindle dx as an e-reader?	1
	it cannot even support the most common file type, pdf, with the basic features.	1
	then you sell students the kindle dx as the highest price at market, $489 + $50 with a cover?	1
	i do not think dx worth the price because it doesn't provide the complete features for academic users, i cannot annotate/zoom in/out the most files(pdf) i have.	1
	and there is no proper file organization in dx.	1
	in addition, the text books i brought are only for kindle.	1
	i cannot read w/o the machine.	1
	i do hope amazon would let us upgrade the pdf annotation and zoom features via firmware update.	1
	also the doc, images files syn with personal computers.      	1
	as of 1/06/10 still no plans for epub support!.well, i have been considering the kindle dx as a gift for my sister's birthday, as she checks out library books all the time and is a total bookworm lol!unfortunately, the kindle dx does not support epub to freely download ebooks from her local library.i literally just got off the phone with amazon to enquire about this, was transferred to a '2nd tier' kindle dx specialist who informed me that, as of this date (1/06/10) there are no plans whatsoever for epub support, nor to address this issue in a future firmware update!?	1
	!an ereader that costs $500+ that won't support common, free ebook checkouts from your local library?!?!?	1
	very disappointing, not to mention greedy on amazon's part to intentionally omit this simple service that other ereaders support.	1
	i guess since at this point there are a trillion folks already pre-ordering this thing without epub support, amazon isn't very concerned about this affecting sales.	1
	maybe they're right!	1
	anyway, i'll be getting my sister sony's new ereader that has a touchscreen for her birthday this year, or perhaps the linux skiff 11.5' ereader - or one of the other 16 ereaders annouced to be released soon, all of which will support the open epub format so she can download all the ebooks she wants from her local library for free.	1
	thanks anyway, amazon! 	1
	very nice, but amazon could improve a few things.the big kindle is a very pleasant reading device.	1
	i did not expect that i would like the dx so much better than my regular kindle 2. fonts can be boosted to a pleasant size that make reading better than any 'normal' book.	1
	the most important component of the dx is the large e-ink display.	1
	there is no screen protection so the text seems to appear directly at the surface, just like real paper.	1
	this is better readable and easier on the eye than an lcd screen.	1
	resolution is 150dpi, which is about half of a good printer.	1
	it is sharp enough, but pixels are visible.	1
	contrast could be better.	1
	this is not disturbing for text but it makes kindle simply a poor photo viewer.	1
	in a side-by-side comparison, the dx has a noticeably better contrast  than the regular kindle.	1
	it also easily beats the sony readers.	1
	overall the experience is good, somewhat similar to reading an old newspaper.	1
	i find the hardware design of the kindle very nice and pleasant.	1
	not as good as apple would have done it, but pretty close.	1
	my only complaint is cheap quality and hard click of the buttons.	1
	the clicking sound of the 'next page' button wakes up my wife when reading in bed... the orientation sensor is a little too sensitive, causing unintentional textflips when holding the kindle nearly flat.	1
	i read several academic papers in pdf on the kindle dx.	1
	in the portrait orientation, the dx shows one full letter-sized page on the screen.	1
	since the screen is smaller, text is scaled down to a small size (about 6pt).	1
	its readable, but barely.	1
	turning the kindle 90 degrees enlarges the font to the exact same size as the printed paper.	1
	this is very usable, but not the apex of user friendliness.	1
	there are no other ways to zoom or pan, which is a shame.	1
	the biggest room for improvement on the kindle is the software.	1
	its okonce you're reading a book: that just requires tapping 'next page' a few hundred times.	1
	but it hurts to be confronted with a the prehistoric user interface when doing anything else.	1
	where do i start?	1
	the biggest issue is that all books and papers show up as a single endless directory listing.	1
	there is no way (yet?)	1
	to group and organize items.	1
	the directory listing itself is very basic: just titles and author names.	1
	there is no cover artwork, nor anything else that gives the impression that this is a big stack of books.	1
	the huge screen offers ample opportunity to do this right and make it look pretty.	1
	amazon's cupetino-based kindle engineers could learn a lot from their apple colleagues across the street.	1
	the 3g wireless connection can be quite sluggish at times, especiallyif network coverage is borderline.	1
	even with good 3g  coverage the basic responsiveness of the e-ink display simply does not allow for quick browsing.	1
	shopping for books is much more convenient on an iphone or on a regular computer.	1
	given this, i do not expectthat the 'experimental' web browser is useful except in emergencies.	1
	finally, how would the new apple ipad stack up against my kindle dx?	1
	is is the kindle-killer as the press reports?	1
	here is a quick 'apples' to 'kindles' comparison: form: wider (ipad) vs taller (not much difference in size)design: really nice (ipad) vs quite nice (dx)interface: multitouch vs dozens of buttonsscreen: 1024x768 color lcd vs 1200 x 824 greyscale e-ink.weight: 730 gr vs 535 grbattery life: 10 hours vs many daysprice: $629 (ipad 3g) vs. $499 (dx)monthly cost: $29 vs $0 (books likely more expensive for ipad)software interface: smooth & fast vs dorky lines with slow refreshversatility: multi-purpose vs e-reading onlyreadability: e-ink likely better in sun and easier on the eye.	1
	overall, its a hard comparison to make.	1
