	different and better.i have owned both kindle 1 and kindle 2, so i'm already committed to the basic idea: e-ink reading in a slim form factor with excellent connectivity to a large selection of books and subscriptions.	1
	i have come to rely on my kindle experience, and it has seriously enhanced my reading.	1
	the dx was not an obvious upgrade for me, but two features put me over the edge: the larger screen, and the native pdf reader.	1
	i now have the dx in my hands, and can report pros, cons, and neutrals: pros: -- the larger screen is a definite plus.	1
	i use the larger type size on my kindle 2 (older eyes), and at this type size i get far more text per page on the dx.	1
	this makes the whole reading experience more book-like (and should be a boon to people who buy large-print books.)	1
	-- the screen is also sharper and crisper than my kindle 2 in a side-by-side comparison: the text is darker, and the contrast is much better, making for better visibility overall.	1
	-- on a side note, the larger screen also makes it possible to read poetry on the kindle, even at large type sizes.	1
	on earlier kindles, the smaller screen cut off lines, so that you would lose the sense of when the poet ended the line.	1
	on the dx, you can see the whole line exactly as the poet meant it, with the cut-off in the right spot.	1
	-- the pdf reader works as advertised, and is extremely convenient.	1
	pdf documents appear on the dx exactly as they do on a computer screen.	1
	moreover, you can drag and drop your documents directly to the device using the usb cable (or use the for-a-fee email if you absolutely must.)	1
	the only downside: at least for the documents that i've used so far, i cannot adjust the type size as i can with native kindle documents.	1
	-- screen rotation also works as advertised: it operates as a mild zoom on both graphics and text and offsets slightly the downside of not being able to adjust the typesize on pdf documents.	1
	one nice design touch: the four-way navigation stick introduced on the kindle 2 is rotation-sensitive, and will move as expected relative to the screen rotation.	1
	-- more of the device space is devoted to the screen, while the white plastic border around the screen seems to have shrunk, both in general and compared to the proportion of screen to plastic on the kindle 2. i like this (but see below about the keyboard).	1
	-- storage: i like the increase in storage space, and don't mind the lack of an external storage card.	1
	i can see some people having trouble with this, but only those folks who either a) must regularly carry around pdf documents totalling more than 3.5 gb of space or b) must have nearly 3500 books regularly at their fingertips.	1
	i fall in neither category.	1
	cons: -- price: it's expensive, as you can tell pretty quickly.	1
	if you value the larger size, and the native pdf reader, these features may justify the roughly 30% premium you pay for the dx over the kindle 2. in truth, the dx should cost more than the kindle 2, and a 30% premium isn't unreasonable.	1
	but, for my money, amazon should drop the price on the kindle 2 to $300 or so, and charge $400 or a little less for the dx.	1
	still, i bought it, and will keep it at this price.	1
	-- one-sided navigation buttons: all of the buttons are now on the right side, and none are on the left.	1
	i'm a righty, so i shouldn't complain, but i found myself using both sides on the kindle 2. lefties have reason to complain, i think.	1
	-- one-handed handling: i often read while i walk, with my kindle in one hand, and something else in my other.	1
	because of the button layout, this will be more difficult on the dx.	1
	-- metal backing: i miss the tacky rubberized backing on my kindle 1. when i placed my kindle 1 on an inclined surface, it stayed in place.	1
	not so my kindle 2 and now my dx.	1
	this is not a complaint specific to the dx, but it's still there.	1
	neutrals (i.e.	1
	things worth noting): -- weight: the dx is heavier, noticeably so.	1
	this is only an issue if, like me, you regularly use the kindle with one hand .	1
	.	1
	.	1
	and even so, it's still doable.	1
	-- keyboard: the keyboard has 4 rows, and not 5: the top row of numbers from the kindle 1 and 2 has been merged into the top qwerty row, so that numbers are now only accessible with an alt-key combination.	1
	the keys are vertically thinner too, so that the whole keyboard is no more than 1' tall (compared to over an 1.5' on the kindle 2).	1
	at the same time, the keys themselves are a bit easier to press, a bit more protruding than on the kindle 2. for someone with big fingers (like me), this will be a slightly harder keyboard to use, but only slightly.	1
	that's all i can see.	1
	overall, the pluses outweigh the minuses for me, and i'm satisfied with my purchase.	1
	i can now think of using my dx for work documents on a regular basis, because of the pdf reader.	1
	the screen size and screen rotation make the overall reading experience more immersive.	1
	overall, the dx feels more like text and less like device and comes closer to the stated goal of the kindle: for the device to disappear, leaving only the joy of reading.       	1
	dx not quite all that.i owned the k1 and then the k2 and love them both, so i was really looking forward to the dx.	1
	my plan was to use the dx at home, and keep my k2 for carrying all over creation with me.	1
	it wasn't long, though, after my dx arrived the day before yesterday before disappointment set in.	1
	don't get me wrong, there is a lot to like about the dx: 1) pictures are awesome on it, if the publisher formats them properly.	1
	2) those who complain about darkness of text on their k2 (a problem i've never had, btw) will be thrilled by the dx's very dark text.	1
	3) the ability to rotate the screen is great.	1
	gives you a closer look at things like maps and charts.	1
	4) the browser is a bit faster than on the k1 or k2, though that isn't saying much--it is still very clunky to use.	1
	5) but web pages look pretty good on the dx.	1
	6) it holds 3500 books.	1
	but.....the dx just isn't all that.	1
	it has drawbacks that are really making me consider sending it back before my 30 days are up: 1) first and foremost, while it is true that it natively reads pdfs, it is really only a pdf *viewer*.	1
	you can't change the font size on pdfs, links will not function on them, and the ability to magnify pictures doesn't work on them either.	1
	so you better have large fonts on your pdf before you load it.	1
	looking at the pdf in horizontal mode helps a bit, but not by much.	1
	2) the dx is too big to hold comfortably.	1
	it's not really all that heavy, but it is top heavy and you feel a pull on your hands.	1
	and that pull is really evident if you try to use the keyboard while holding it--you practically have to lay the dx down flat, it becomes so difficult to type.	1
	3) they merged the number keys with the qwerty keys (losing a line of keys).	1
	what development genius thought it would be helpful and an 'improvement' to have to press the alt key every time you wanted to type a number?!?	1
	4) before my dx came, i really didn't think this would bother me at all, but i have to say: i really hate the fact that the 'next page' button is only on one side.	1
	i mostly use the left hand button.	1
	and yes, with the dx's rotation ability you can turn it upside down, placing the 'next page' button on the left side.... however, when you do this, the button is so high up that you have to slide your hand (not your thumb, your whole hand) up in order to turn the page.	1
	may sound nit-picky, but it is truly a pita to break off reading to do it.	1
	not only that, but having the keyboard at the top makes it even more top-heavy than when it is right side up!	1
	5) when you rotate the dx so that it is horizontal, the 'next page' button is either at the bottom or the top--in either case you can't just flick your thumb and change the page.	1
	again, a pita.	1
	6)  if you leave the rotation feature on 'auto' when you are not using your dx it drains your battery, so you must remember to turn the feature off when you stop reading.	1
	7) still no folders.	1
	an organization nightmare three times bigger than that of the k2 (which itself had increased the same problem on the k1):  the possibility of storing 3500 books but only being able to sort them by author, title, and 'most recent first.'	1
	i will be fiercely debating with myself in the next week or so, on whether i really want to keep the dx.	1
	it is so disappointing.	1
	it has the potential of being a really great e-reader...but as it stands now, it isn't.	1
	it's ok.  but for $489, it should be a lot more than merely ok.	1
	sorry sony prs-505... i'm moving on.	1
	perspective from a biomedical researcher.i don't generally write reviews, but i hope this one will be useful for other scientists who are contemplating a kindle dx.	1
	my use for the dx will be different from most of the users who have posted reviews.	1
	i maintain a library of nearly 4,000 pdf manuscripts/grants/documents.	1
	i probably have minimal use for ebooks from the kindle store.	1
	the number of pdfs is constantly growing as new research manuscripts are published (and downloaded to my computer).	1
	my principle reasons for purchasing a dx were to: 1) carry the electronic equivalent of binders of pdfs with me when traveling.	1
	an ipod for pdfs.	1
	this is a metaphor that works for the way that i view an ereader, though it probably doesn't apply equally well to everyone.	1
	2) have an easier way to read papers when traveling.	1
	easier means not worrying about battery life, unfurling a laptop in a cramped airplane, or carrying a bag full of papers.	1
	3) reduce eye strain from staring at a computer screen by moving serious reading from the laptop screen to the dx.	1
	from my preliminary use, i think the dx is a qualified success.	1
	text in manuscripts looks great.	1
	figures from manuscripts do not render well in portrait mode if there is a lot of detail; switching to landscape mode helps substantially.	1
	zoom into individual images/sections of pdfs would be welcome.	1
	navigating large numbers of pdfs from the home screen is currently clumsy.	1
	lack of directory support to organize large numbers of files is an issue.	1
	i've read about users using complex naming conventions to use 'search' as an indirect way to find files.	1
	renaming hundreds (or thousands) of files to make them easier to find is not a great solution.	1
	i suspect this will improve in time, either through a firmware update to this device or in the next generation of hardware.	1
	i'm also hoping against hope that one or more of the reference manager software providers (bookends, i'm looking at you) realizes that their software is to the kindle as itunes is to the ipod.	1
	if i could manage the content of my kindle through a reference manager, i would be thrilled.	1
	the idea of downloading a paper and syncing it in one step to the kindle to take with me is really appealing.	1
	this wouldn't completely overcome the problem with a flat file hierarchy once the papers are on the kindle, but it would help organize getting content onto and off the device.	1
	the biggest surprise to me is the functionality of the web browser.	1
	yes, it is pokey to render pages.	1
	no, i wouldn't want to use it to web surf.	1
	but if i had a destination web site that is heavy on content, i think reading on the kindle will be vastly superior to reading on the iphone or other mobile/tablet devices.	1
	i do doubt, however, that wireless data access will remain free on the kindle long-term.	1
	i can't imagine how amazon will be able to continue subsidizing the data costs.	1
	i think that this is a feature that should be enjoyed while it lasts, but i wouldn't be surprised if it goes away at some point in the future.	1
	though it adds another $50 to the cost, i think the matching case is attractive, functional, and creates an easy-to-carry package.	1
	so is it worth the high cost?	1
	i don't think i (or anyone) can really evaluate that until determining how well it integrates into daily work habits.	1
	i suspect that i will get heavy use out of it, but then i read a ton of pdfs.	1
	i do hope that the pdf support for dictionary lookup, highlighting, and annotation improves, but i base my review on what the product does - not what i would like it to do.	1
	hope this helps other heavy pdf users!      	1
	kindle dx - amazon's apathy and greed at work.first, let me say that i purchased and use my kindle dx daily.	1
	i thought about how to accurately write this review for some time now.	1
	when it gets right down to it, all ereaders on the market - and the flood now hitting the market - use the same e-ink panels made by the same company, generally have the same features as far as reading an actual book, etc.	1
	when this was a niche product in a market with no real competition than the product would get a much higher rating.	1
	however, it is now a market with many choices.	1
	the only way to be fair about writing a review is to assume that there are some basic functions that must exist (wireless access, reader screen quality, basic zoom/bookmark features, etc.)	1
	that all e-readers today have.	1
	the review should be what is unique about the kindle dx and review those features.	1
	if you just want to download a book and read it on an e-ink panel than every single e-reader on the market today will work fine.	1
	to that end, when looking at what makes the dx unique, i have to honestly say that i would not purchase this reader again - there are better options out there with several more just announced.	1
	after careful consideration, it becomes clear that amazon just felt that they could get away with a sub-par device based on their name and position in the market.	1
	1) pdf issues: this is a larger format reader, presumably for the purpose of reading standard sized documents (8.5' by 11').	1
	it is also being marketed heavily to students.	1
	both of these demand native full pdf support.	1
	while the kindle dx does render pdf's, it does so in an extremely crippled way.	1
	while i am well versed with the fact that some pdf's are rendered as images and the document itself does not contain links or text, most do.	1
	despite that fact the kindle does not allow you to change font size, add bookmarks, highlight text, use the dictionary feature, zoom in, use any links (i.e., the table of contents), etc.	1
	in other words, it presents that pages as pictures and provides absolutely zero 'digital control' over the documents - the very features that someone would want to use an electronic reader instead of a hardcopy for.	1
	i purchased this device as an engineer because i have hundreds of pdf's (manuals, client systems documentation, etc.).	1
	i have found that i am completely unable to use it for the reason i purchased it for.	1
	other readers treat pdf's as any other document allowing all the same e-reader functions and there is no reason - short of not wanting to pay adobe a license fee - that the kindle does not have this same functionality.	1
	2) file formats:  while the kindle dx does support several file formats, amazon is one of the last holdouts to insist on providing content in a drm protected proprietary format.	1
	they also do not read many industry standard formats.	1
	chm and lit are two of the huge formats that come to mind.	1
	many publishers - especially of technology books - release in chm format, essentially a slightly marked up html derivative that should be easy to render.	1
	mobi and others come to mind as well - with over 1,000,000 public domain titles available from many web sites in these other formats.	1
	yes, i understand protecting content - but amazon has gone overboard in trying to lock down the kindle to only offer 'all the features' on their proprietary format.	1
	this locks you in to buying ebooks from the kindle store.	1
	i understand the financial drive to do that - but most of us have documents that we have created, or content we have previously purchased for other platforms and have rights to, that we would like to read on the kindle.	1
	devices that restrict access to their own formats are generally given away or sold for a very low cost, with the understanding that the profit will be made on content (think about some of the original movie on demand set-top devices).	1
	amazon is selling this as a standalone device, and needs to not intentionally cripple it.	1
	and yes, there are tools to convert file type - which usually result in formatting issues and the burden should be placed on the end user.	1
	3) file system flaws:  amazon advertises the ability to hold 3,500+ books/documents (a huge exaggerating in and of itself).	1
	even if it held 350 titles, the file system has a huge problem.	1
	there are no ways to create any type of folder structure.	1
	you have to go to a single large flat listing of the documents on the reader and hit next page over and over - a painfully slow process in and of itself - and hope do don't miss the title you were looking for and have to start over.	1
	yes, the titles do start in alphabetical order, but they change based on most recently read being moved to the top.	1
	it is a ridiculous and unrealistic expectation to put more than a couple dozen documents on a device without any way to organize them into folders.	1
	the official amazon reply:  you can add tags and search by tags.	1
	yep, you can - and if you want to take the couple weeks it would take to add tags to a couple thousand pdf's then you have far more free time than i do.	1
	the kindle was purchased to save time - not to use my entire annual vacation time to organize it.	1
	4) no card reader:  for some unknown reason, amazon decided to not include any type of card reader.	1
	the memory can hold a large number of books - but pdf's can get to be 100mb or more if they are heavily diagrammed.	1
	the memory cannot be upgraded, so there should be some method to pop in a memory card.	1
	all of my cells phones have had this feature...and my $500 kindle dx does not?	1
	5) ergonomics:  i admit that the e-reader market is emerging so there has not been a large pool of users to pull opinions from.	1
	that said, it seems that the kindle dx made it through the art department and skipped the usability testing department.	1
	while it looks great and each to carry, the 5-way joystick thing, the lack of next/previous page buttons on both sides (that existed on previous models) and the absolute worst keyboard i have ever touched do not help the device.	1
	again - being marketed to students and professionals - just look at the official page on the amazon site.	1
	what is on the screen on the largest image there?	1
	it is a power plant diagram - not a page from a nyt best seller list.	1
	there should be a way to quickly type notes on things.	1
	there is no possible way a student could sit in a lecture and flip through pages and be able to type in notes and keep up with the class on this thing - completely unrealistic.	1
	6) no desktop application: while amazon advertises that no computer is required, they leave out the fact that even if you had one there isn't really anything you could do with it.	1
	there should be some application similar to apple's itunes that will auto convert file formats and allow organization of files and folders (if they existed), allow backup in case the device is lost/stolen/damaged and needs to be replaced, etc.	1
	this is especially true for students that would desire a full sized keyboard to add notes to documents/books and sync with the kindle.	1
	bottom line: the kindle dx is an absolutely great e-reader for someone that wants to simply read books, is comfortable buying only kindle content and just desires a larger screen.	1
	this is what i am now using it for.	1
	to this end it works great.	1
	if this is your only expectation - then get out the credit card.	1
	if you have fantasies of using it to actually read pdf's with any functionality, store a large number of documents, use it in a classroom setting, etc.	1
	then get a different e-reader and sacrifice battery life and get a tablet or laptop and wait for the next generation.	1
	do not buy this product!!	1
	amazon will deny warranty when unit defective!	1
	!.my kindle dx shipped july 30.  i really liked it until today.	1
	there is a white out on about 1/12 of screen so you cannot read many words on the page and the text is running veritical and horizontal at the same time.	1
	the product has not been dropped or otherwise damaged during use.	1
	when i called amazon kindle support they said they had never heard of problem, even though i told them i found in a few seconds on the web.	1
	they asked me to reset, which i did, but problem persisted.	1
	i was then told that the problem was not covered by warranty!!!!!!!!!!!	1
	i asked how could they know that without looking at device and they said it was not on known list of manufacturer defects.	1
	they told me to not even bother sending it in for warranty service but if i wanted a new one, i could pay them $250.00!!	1
	i spoke to 2 supervisors at the washington call center who gave me the same line.	1
	amazon is not standng behind this product, and this is the worst example of poor customer service i have encountered.	1
	i asked them how could they make a technical diagnosis over phone and they had no good answer, just kept repeating that it was not a covered defect.	1
	i asked them why they would not just say 'send it in and we will take a look at it', and they said it was a waste of time because it was not covered (even though they were 3000 miles away from unit and had not seen it)  they wiggled when i demanded a written explanantion of denial of warranty service ( which to me is breach of contract.	1
	do not buy this product.	1
	amazon should be ashamed of itself.	1
	they have lost a valuable and up to now loyal customer.      	1
	from a first time kindle buyer: good, but not perfect.first off, i am a first time kindle buyer, so this review will be more geared to those buyers thinking of entering into the kindle market, not a comparison of past editions.	1
	my first impression of the kindle dx was that it was actually very small compared to what i expected.	1
	the entire device is slightly smaller (in height and width) than a piece of paper, with the screen taking up approximately 85-90% of the front.	1
	this was actually a nice surprise, since i wanted something very portable, but good for magazines/research articles.	1
	after seeing the size of the dx, i think a k2 would have been way too small for what i want.	1
	at the same time, the device is very hefty.	1
	picking it up, it becomes almost tiring to hold up in one hand for too long (another reason i think this one is better geared toward short articles instead of extended novel reading).	1
	it has a nice solid feel to it, but for some reason i was expecting it to be lighter.	1
	the kindle only takes a couple of seconds to power up and immediately goes to the last article you were reading.	1
	a row of buttons are positioned on the right, which let you go to the main home page, go to the next page of an article, previous page, bring up a menu, or go 'back'.	1
	there is also a small four-way joystick to navigate around (which also has the ability to be pressed for selections).	1
	the joystick is very sensitive and easy to navigate with, although not overly sensitive that you hit things by mistake (at least very often - it has happened a couple of times so far).	1
	for those in the market for an ereader and can't decide between the kindle and another device, i can tell you what made me go toward the kindle: whispernet.	1
	it is a free, no subscription based service that comes on all kindles.	1
	you get free access to the internet anywhere sprint reception can be found.	1
	you can purchase books/magazines/newspapers anywhere, and have them in less than 60 seconds.	1
	you can access the web, check your web-based email, look up directions, find weather reports, movie times, etc.	1
	although the kindle terms say that normal web browsing might result in extra charges, my assumption is that this clause will just cover amazon if they choose to charge for web in the future.	1
	as of right now, everything is free.	1
	the web browser is very rudimentary and does not show pages very well.	1
	even most pages designed for mobile phones showed up badly for me, although some were okay.	1
	the browser is very slow, but could really come in handy if some information was needed and no internet was available.	1
	i have tried several blogs and magazines, as well as the native pdf viewer and all seem to produce well formatted articles with crisp, clear pictures.	1
	lighter pictures tend to show up better as darker pictures blur together if they do not have enough contrasting elements.	1
	the one problem i have noticed with the pdf viewer is that some text/elements can end up being very small and hard to see.	1
	the pdf viewer is stuck on one size, which is slightly smaller than most pdf's are intended to be viewed at.	1
	there is no way to increase font size, and the only way to zoom is by rotating the display.	1
	this zooms in on the top or bottom half of the screen.	1
	rotating to a landscape display actually helps that problem a great deal, but some sort of zoom feature would have been nice.	1
	you can search in pdf documents or go to certain pages, but it is impossible to annotate as the kindle lets you do in normal document files.	1
	pdf documents can be sent to the kindle dx via usb cable or through a special email that is set up for the device.	1
