	i have found that i can set the dx on my treadmill or elliptical trainer and read fairly comfortably.	1
	the dx's size means i can set the font size larger and still require fewer page turns than the 2.the dx is a little more cumbersome to lug around, but it's not completely unmanageable.	1
	i could fit the 2 in my back pocket, but rarely did for fear of sitting on it.	1
	the dx won't fit into any pocket, but it's certainly at least as portable as any hardcover, and some paperbacks.	1
	pdf journal article reading:the .pdf formatting for radiology journal articles has so far worked pretty well.	1
	the page formatting thus far has been identical to what i see on my computer screen.	1
	the text with the .pdf in portrait mode is usually too small to read comfortably, but it's very readable while in landscape mode.	1
	image quality is surprisingly decent.	1
	it has usually garnered favorable impressions from the radiologists who've seen it.	1
	cross-sectional images, in particular, are usually easily interpretable on the dx (particularly if arrows are added).	1
	radiographs are harder, but frankly they're not all that great on the printed page either.	1
	one big complaint (already observed by others on amazon's boards), is that the pagination in landscape mode doesn't work.	1
	as you page through a document in landscape mode, you quickly get off of a 'top-half/bottom half' separation and start having part of the bottom of one page displayed with the top of the next.	1
	to reset this, you have to switch back to portrait mode, and then back to landscape mode (tedious).	1
	this should be fixed, and i can't imagine it would be difficult to do.	1
	another complaint is the lack of folder architecture.	1
	this is a frequent complaint, so i won't go into it too much here.	1
	it does seem a little silly to have a device with 4 gb of storage and no clear way to organize dozens (or hundreds) of documents beyond alphabetizing them.	1
	i end up copying and deleting articles using the usb cable, and will probably continue to do that until a better kindle software solution presents itself.	1
	the bottom line is that i can and do read radiology articles on my device.	1
	there are still a few quirks, but right now i think it's better than any other e-reader out there.	1
	that may change in a year or so... (yes, the printed journal itself or laser copies are probably still better quality, but that's missing the point of this review, no need to point this out.)	1
	device issues:wireless connectivity is good - on par with the kindle 2, which was decent.	1
	i get pretty good service in most metropolitan areas.	1
	again, one of the main benefits of the kindle is the ability to download any book you want when you want.	1
	using the experimental web browsing feature, webpages come up pretty quickly, and if you use the mobile links to popular sites (which are mostly text) they're really pretty useable.the gyroscope/auto rotation feature works ok, although i've found with the dx it isn't as useful as with an iphone.	1
	or maybe it doesn't work quite as well....i tend to read with the device flat, and it can get confused and randomly rotate the screen if it's slightly tilted off axis while flat.	1
	battery life is on par with the 2 - still excellent.	1
	i get about 2 weeks out of a full charge if i don't have the wireless modem on (which i usually don't).	1
	one big caveat - others have noted that having the auto rotation feature turned on will slowly drain battery life.	1
	because of this, in addition to the fact that i don't like having auto rotation on, means i simply manually rotate the page when i need to.	1
	keyboard is smaller than 2's, which is fine since it gives more space for the screen, and i don't use the keyboard much anyway.	1
	it is a little irritating to press function keys for the numbers, though.	1
	the dictionary look up feature is still awesome.	1
	if you like to read books that challenge your vocabulary, it's great to immediately get a definition without pulling out a dictionary and rifling through it.	1
	the screen quality is on par with the 2. in general, the font seems bolder and darker than the 2, independent of text size.	1
	picture quality is about the same.	1
	i don't use the text-to-speech or the mp3 features.	1
	they're the same as the 2, except there's a female text-to-speech voice on the dx.	1
	summary: pros:larger screen sizepdfs display wellimproved font qualityconvenience of book purchasing cons:slightly heavier and less portablepagination of pdfs in landscape mode doesn't work wellneeds folders (or better file organization/searching)price bottom line....as both an avid reader and a radiologist (and an early adopter, and a technophile), the dx has been a great device for me.	1
	i recommend any kindle to anyone who enjoys reading (technophile or not), and the dx to those who want the option of reading .pdfs and having a larger screen, with the sacrifice of some portability and price.	1
	finally a good pdf reader.overall, a good buy.	1
	there are a number of e-book readers out there from sony, to jetbook (see my other review), to irex, eslick, and obviously, the older versions of the kindle.	1
	one of the key features that i was looking for was the ability for the reader to read and process pdf documents.	1
	i would have liked other formats (word, xls, etc), but pdf is the bare minimum as many technical journals, work documents, etc are pdf formatted.	1
	i never felt comfortable with sending the document to amazon to be converted as i am worried about security and unlawful viewing of confidential documents by someone other than myself.	1
	with the dx, problem is solved!	1
	the large screen is great for documents that cannot be 'reformatted' - i.e.	1
	pdf.	1
	carrying it is a little difficult, but it is a price you pay for features you want.	1
	the device is thin and even weighted, so holidng it is not an issue.	1
	it is heavier than the smaller one, so you hand gets tired after about 30-minutes or so.	1
	reading newspapers such as the nyt is much easier on the dx than a smaller screen device as you can imagine, and you get used to the 'flicker' when you turn a page.	1
	the wireless - oh, the wireless; it is priceless.	1
	buy, view, read, and get the latest content is real-time without the need to sync.	1
	that was always a pain for me as i forget to sync or copy my files from one device to the next.	1
	you still need to connect to the device to your pc to copy things like pdf docs over, but that's ok.   what i don't like about the kindle are as follows (ordered of importance): - memory expansion to sizes of 16g+ is needed- would have liked bluetooth as an option to connect and copy files from my pc to the device.	1
	as far as i am concerned, you dont need to sync via wire anymore.	1
	- wireless is great, but it is not a general web browser.	1
	this can be a benefit if you are on the road.- color screen is a must - i heard that this will be the next version- price is little too much  i am happy with the dx - it was a good buy and i highly recommend.	1
	made the right choice with the dx.after reading many user reviews, i took the plunge and purchased the kindle dx.	1
	the original size never appealed to me because it seemed too small.	1
	i don't like to read paperbacks, so i knew i wouldn't like an 'e-paperback.'	1
	when the larger size was introduced, i got interested.	1
	some of the reviews of the dx make it sound like a mammoth device, but for anyone used to reading trade paperbacks and hardbacks, it is maybe a little taller but only half as wide.	1
	it is a little big to carry around every day, but portability was not an issue for me.	1
	i bought it to cut down on the number of books i bring into my house.	1
	when i got the dx, i was worried at first about the gray background.	1
	it seemed a little dark, but i quickly realized that it is much easier on my eyes.	1
	i usually read in bed and couldn't manage more than 15 minutes or so before my eyes tired out.	1
	now i am reading for an hour or more with no eyestrain at all.	1
	some reviews make it sound like the dx is better as an academic tool or pdf and publication reader than a book reader.	1
	i think it all depends on what you want the kindle to do.	1
	if you want it to replace the paperback in your backpack, the dx is not the device for you.	1
	if you're a home reader whose home is becoming overrun with books, it's a great alternative to more trades and hardbacks.       	1
	review of a new kindle owner.the dx is my first kindle, so i thought that i would share my first impressions with those wondering what it's like.	1
	size: too big to hold comfortably in one hand.	1
	this is more an issue of /size/ than weight (the center of gravity is so far from where you hold, that you have to cantilever it quite strongly).	1
	however, if i rest it on my forearm, with my hand wrapped around the opposite edge, it's actually quite comfortable (and, hey, my left hand reaches the next-page button *perfectly* that way).	1
	also comfortable: reading in bed (use hand to prop it up, but let the weight rest on your torso).	1
	sitting and reading: hold in 2 hands, resting on leg, couch arm, etc.	1
	as long as you don't try to support it with just one hand, you should be fine (note forearm solution above works just fine).	1
	the screen is about the same size as a hardback-book page, which i don't find too big at all.	1
	but, then, i enjoy robert jordan and other prolific authors.	1
	screen: really, really clear.	1
	need to sun-test it, when i have some sun (cloudy yesterday).	1
	graphics are great, as is the text.	1
	i can read the smallest size, but am happier with a slightly bigger font, so it's on size #2 right now.	1
	keyboard: i /like/ that it's small.	1
	hitting numbers is awkward, but the #1 purpose of this gizmo is reading.	1
	i write computer sw, and expect to use this as a mobile net-tablet from time to time, but i'll sacrifice a bigger keyboard for a slightly smaller device happily.	1
	one-side buttons: i did a little auto-rotation to test, and the higher position you hold you hand when the buttons are on the left is almost more comfortable than the right-hand position for me.	1
	i don't think that it will take long to get used to just the one-side buttons for old k2ers who have an open mind.	1
	kindle experience: matches what everyone's said about the k2/k1... so nothing to add here.	1
	my big complaints are the typical kindle thoughts: some way to organize content is /essential/, epub support, etc.      	1
	love it - only small improvement points.	1
	good, but still a few issues for technical users.the built in pdf reader is great, but if this is going to truly be a device for 'all of your personal and professional documents on the go' there is still a little bit of work needed.	1
	i see two issues - first, for business users, there is no file structure.	1
	so those 3500 documents?	1
	yeah, you have to scroll through them all to find the one you want.	1
	second, there is no note-taking ability in the pdf reader.	1
	you can still convert pdfs through 3rd party software to get this capability, but then you lose many formulas, formatting and pictures from the pdfs.	1
	if amazon can come up with a better conversion or a way to take notes in the pdf files, this is a win for technical users.      	1
	the kindle to get: dx.	1
	i quite like it..i purchased the original kindle (v1) a few months after it came out and was supremely underwhelmed.	1
	i ended up disliking the drm (i can't view the books on my computer?	1
	i can't print them?	1
	i can't sell them to someone else?)	1
	and so it became nothing but a glorified new york times reader.	1
	the screen was too small, the page turns too frequent (although they ceased being annoying after about an hour or two of use), and the lack of pdf made it of very limited use.	1
	for some reason, despite my recommendation to everyone not to buy a kindle, i nonetheless bought the kindle dx.	1
	i think i just wanted to give jeff bezos another try, despite his hypocritical (ok, pragmatic) attitude on drm.	1
	the kindle dx is great.	1
	i still won't buy any drm books from amazom, but here are the major pluses: * pdf works, very, very well.	1
	i only found one book so far which wouldn't render - a very pretty, multicolor organic chemistry textbook (original pdf, not scanned pdf).	1
	* the large screen is an absolute joy.	1
	it's like reading a hardback with small print, which is just what i like.	1
	and, when it's dark or i'm not wearing my glasses, i can up the type size to keep it readable in any situation.	1
	* newspapers are easier to read than the original kindle.	1
	and, since you are probably like me in that you toss the issues when you're done, not having to do that saves time and effort.	1
	it's also a lot easier to read on the subway.	1
	the kindle dx does have a few drawbacks from the kindle v1: * no expansion memory or swappable battery.	1
	clearly, following apple's (poor) lead here.	1
	* does not automatically save each issue of the new york times.	1
	i have to tell it to keep each issue individually, or it will auto-delete them.	1
	it's digital data; i plan to archive it permanently.	1
	(i paid for it, after all.)	1
	* newspapers are locked to a single kindle.	1
	you can't read the nyt on your iphone and the kindle, and if you lose the kindle you have, you can't read the files on another kindle.	1
	the bottom line is that the pdf support is the game changer.	1
	i have quite a few documents in pdf that are now a joy to read (including my own latex files).	1
	want to read about sotomayor from the crs?	1
	download the pdf to the kindle.	1
	too lazy to read wikileaks in preview (or reader, etc.)?	1
	read it on the kindle.	1
	the other complaints relate to price.	1
	amazon does not sell a 'print + kindle' book bundle for a reasonable price (say a buck or so above print price), although i think they should.	1
	i would buy everything that way if i had the choice.	1
	additionally, the kindle book prices are way too high.	1
	$7.99 for a print book, or $7.99 for a kindle book?	1
	really?	1
	even $9.99 (their 'bestseller hardcover' price) is too much for a book you are basically renting until amazon decides to cancel your account (which they have done, and causes you to lose access to all your books once your kindle breaks).	1
	and there is no way i'm going to pay more than that for a technical/physics/chemistry book (which are the majority of my purchases from a dollar perspective if not volume).	1
	still, if only for the pdf, larger screen and and new york times ($14/month kindle vs. about $30/mo print), i finally actually like the kindle and recommend the dx to anyone else who would avoid buying any kindle books from amazon.	1
	the device itself rates almost 5 stars (perhaps 4.5).	1
	the kindle book service rates 1 star (would be zero but you can't choose that).	1
	the kindle newspaper service rates about 3 stars (1 since you can't archive or transfer them, 5 because it's so convenient and reasonably priced).	1
	i wish the economist were offered on the kindle.      	1
	well worth the extra cost.as a committed kindle user, i wasn't sure that i needed the dx.	1
	but after having it for three days, i'm hooked.	1
	the larger screen is exactly what i needed to make kindle reading better, and it's much easier to read newspapers and cookbooks on the dx.	1
	i like it better for general reading, too.	1
	all in all, a great buy.       	1
	love my kindle.	1
	kindle dx 9.7 is the greatest.i received my kindle for christmas.	1
	i really wanted one, but was uneasy about spending the $$ without being able to look at one - other vendors of these types of devices allow previews.	1
	in any case, i did receive the kindle and absolutely love it.	1
	reading isn't like looking at a computer screen all day ... which is great.	1
	being able to enlarge the font size is wondeful ... the only minor drawback is the small keyboard .. but i guess i'd rather have more reading space, and it is usable.	1
	instantaneous download is great too.	1
	i haven't been able to see how it reads in the sunlight yet .. probably won't be able to until spring (gotta love that cleveland weather).	1
	i absolutely recommend this product ... i'll never give up normal books, but it's wonderful to have both!      	1
	kindle for the visual handcapped.	1
	moving from kindle 2 to kindle dx.	1
	carryingaround a complete library.	1
	best way to read in so many places.the kindle dx is fantastic!	1
	large clear screen, better reading surface than most books, supremely portable, 'lies flat,' keeps your place.	1
	fantastic for travel - no packing heavy books; also for reading in restaurants (unobtrusive), in bed, anywhere.	1
	access to additional books immediately.	1
	love the ability to change font size, move sideways, turn it over for lefthanders.	1
	pages turn almost instantaneously, not distracting at all.	1
	if you don't keep the wireless on, a charge seems to last forever.	1
	never have to figure out what to do with books after reading them.	1
	recognize it for what it is -- a portable reader.	1
	at that it is unsurpassed.	1
	it could be improved in many ways - cheaper books (but it's still cheaper than buying hard copies); ability to share with 1 or 2 friends as you would a hard copy; better organizing tools (folders!).	1
	if software permitted decent organization it could be a fantastic document organizer for lawyers, marketers, consultants, etc.	1
	those may come someday - for now it is better for its intended purpose than i ever believed possible.      	1
	newspaper first thing in the am.	1
	review of kindle dx and leather cover.	1
	it is wonderful.	1
	kindle dx review.	1
	dx from a former 2nd genner.	1
	kindle dx - nice overall.after trying the kindle app on my iphone (and to my surprise liking it), i decided to splurge a little and get the dx.	1
	after owning it for 2 1/2 days now, i think i've found a great reading device.	1
	my original goal was to try and consolidate a two foot stack of books into this one device.	1
	here are my initial opinions based on the features i've played with so far.	1
	- likes - i love the fact that it's so thin.	1
	when the cover is on it looks like any standard small organizer or notebook.	1
	it's small enough to carry with me anywhere i go.	1
	i really like the wireless capabilities of this little guy.	1
	i can search for and order reading material directly from the kindle, which is nice.	1
	i'm already spoiled by the iphone in that regard, so this is a continuation of that bliss.	1
	i've also tested sending documents to it via [...], and usb.	1
	they all work as advertised.	1
	i did notice that when sending an html page from the web, it didn't format very well.	1
	it basically looked like the programmer's source code.	1
	i sent a recipe with a picture though, it's probably designed to work with a basic page of text.	1
	the thing that sold me on the kindle is the ability to have it read to you.	1
	i love that feature!	1
	i have reference books and training materials that i need to read but can never seem to find the time.	1
	i was able to plop on my headphones at work and in the car and listen with relative ease.	1
	i found myself ignoring the 'fluff' and perking up when something important was being covered, kind of like i do while in a training class.	1
	the ability to carry my books and other documents, whether from email attachments or on my pc is very nice.	1
	the fact that you save an average of $[...] over the hardcopy makes spending the $[...] more palatable ($[...] plus shipping).	1
	i just need to buy about 50 books and i'd have paid for this device.	1
	the sleep screen is pretty cool.	1
	i expected the screen to be blank but instead it shows a full picture of various authors.	1
	i'm guessing that it has a nominal impact on the battery otherwise they would have just left it blank.	1
	interesting.	1
	- dislikes -no light??!!	1
	that seems like a no-brainer.	1
	i'm at a loss as to why this wasn't included.	1
	i'm not even asking for a backlight, which may or may not be technically possible (would be nice though).	1
	how about some pop-up leds to light up the screen similar to what's on some laptops today?	1
	an example of this is the hp 8530p.	1
	instead i have to resort to buying a goofy clip-on light that totally ruins the asthetics of the device, not to mention that it's an additional $[...], adds to the weight, and that i have to keep up with something else.	1
	this omission probably irks me the most.	1
	my wife, however, told me that she doesn't mind not having the light because it feels more like looking at a page then at a computer screen.	1
	i turned off the room light after she said that to make my point.	1
	she countered by flipping on her table lamp.	1
	i guess we agree to disagree.	1
	the other thing that bugs me is the lack of a way to better organize material on the kindle.	1
	sure, you can sort by title, author, or 'recently added', but i'd like the ability to put them in folders, or at least add additional custom fields and sort by those.	1
	for example, i want to separate my reference books from fictional books; or separate my wife's books from my own.	1
	i can tell already that as the number of books grows, the harder it's going to be to find material easily.	1
	a grouping system similar to what you find on the amazon book store would be nice.	1
	a couple of other nuicances i found were the latency issues when using the navigational buttons and the way the screen turns black when turning pages.	1
	the latency isn't bad, but it is noticable and sometimes makes you second guess yourself about whether you actually clicked the button or not.	1
	though i can't compare the weight to previous kindle versions (since i've never owned one), i can say that it could stand to lose a few ounces for a more comfortable one-handed reading experience.	1
	it isn't heavy by any means, but it isn't exactly light either.	1
	i guess it didn't help that i had it latched to the cover either.	1
	the voice that reads to you leaves much to be desired.	1
	after all these years of text-to-speech technology, i was hoping to hear a more natural voice.	1
	no such luck.	1
	it still sounds like a robot is reading to you, although a more refined robot than in the past.	1
	it sometimes errs on pronunciation or has bad grammar.	1
	for example, it flies through bullet points like they're part of the same sentence.	1
	but maybe that's because i'm forcing it to read a technical book to me.	1
	i'd probably do the same if i was reading it myself.	1
	in the end it's good enough to where i can understand without much effort.	1
	- other thoughts -i read that the battery lasts about 4-5 days on a single charge, 2 weeks if the wireless feature is turned off.	1
	i found out that if you fall asleep while the kindle is reading to you, it'll be completely dead when you wake up!	1
	next time i'll have it plugged in before going to bed.	1
	:-) in conclusion, we love the device for what it is.	1
	for me, it's great to have someone read to me since i always seem to be on the go.	1
	it's also great to have one device with most of my reading material.	1
	i find myself more encouraged to read since i have access to new books at any time and get instant gratification by being able to read it within a few minutes.	1
	i can easily see electronic books becoming the norm for publishing in the future.	1
	my wife and i are glad that we'll be ready.      	1
	dx, a fine large e-reader.i've used both a kindle 2 and a kindle dx.	1
	i love each of them.	1
	i dislike reading documents on a computer screen, and i have a large computer screen, but the kindle is a totally different experience.	1
	i am very comfortable reading the kindle, and have read a number of books on it.	1
	it is the size of a book; it has the feel of a light-weight book.	1
	i like the fact that i can travel light, not needing to lug around a pile of books.	1
	kindle 2 vs dx:  i prefer the kindle 2 to the kindle dx, because of its smaller size.	1
	it's easier to carry around, from room to room, or in a briefcase or pocketbook.	1
	the large size of the dx is the only reason i give it 4 stars instead of 5.  however, if you will be using the largest font size (one can choose small print, large print, or several in between), then the dx would be preferred to the kindle 2, because of its larger page size.	1
	these are breakable, and need to be handled carefully.	1
	they will break if stepped on or dropped.	1
	a cover is a good idea.	1
	the expensive soft leather cover has a marvelous feel.	1
	the less expensive black amazon-logo cover works fine also; it has slightly easier access to the on-off switch and a tighter fit than the more expensive cover.      	1
	i love this thing!!	1
	!.	1
	outstanding product!!!!!	1
	!.i have been watching these devices since they first came out but resisted due to the small screen sizes.	1
	reading on my laptop is awkward and takes time to boot or restart each time.	1
	i travel quite a lot so i usually take a book or two along, so this larger size unit seemed ideal for me.	1
	i received it yesterday and and thus far i'm entirely satisfied with it.	1
	it starts quickly, is very legible, user friendly, the whisperjet downloads are very fast and easy to accomplish.	1
	i would like to see a brightness adjustment though as the screen needs some adjusting in differnt light situations.	1
	other than that though it is a very nice item!      	1
	great ereader... but not quite there yet.as a biology graduate student, i suppose i am part of amazon's target audience for the dx.	1
