	my daughter who is starting college liked it so much, i had a hard time getting it away from her.	1
	she bought her own kindle the same day and now we exchange books.	1
	i like being able to change the font and it is easy to take everywhere i go.	1
	it downloads books so fast and i like being able to sample a book before i buy it.	1
	all my friends are amazed and want one.  	1
	kindle dx - excellent product.	1
	heavy and still not perfect, but very helpful tool.	1
	kindle dx.	1
	kindle for quad.	1
	exactly what i expected.	1
	kindle dx wireless reading.	1
	attention rural owners!.i got my kindle dx for christmas and have had it for a little over 24 hours.	1
	i have been reading on it almost constantly except for sleeping in that time.	1
	i love it.	1
	i find myself forgetting that i am reading from an electronic device and try to turn the page.	1
	the only cons i find are the lack of a backlight, really for the price you pay it should include a backlight and the internet connection.	1
	i live in eastern kentucky in the appalachain mountains and our 3g service is non-existant.	1
	i will for the near future have to download my books to my computer and then to the kindle.	1
	it is painless process and one that i expected due to my location.	1
	never fear,if you live in a rural area you can still download your books in about a minute.	1
	i don't believe that amazon makes that clear enough.	1
	i also have the leather cover which is a great asset.       	1
	the kindle dx.	1
	my wife's kindle.	1
	i can finally move again.	1
	best invention of the 21st century!.	1
	perfect!.	1
	best thing going.	1
	awesome kindle.	1
	it is wonderful.	1
	although expensive, it's a must have.	1
	good stuff.i like it.	1
	it is the only device on the market that can display my pdf docs.	1
	the screen size is just enough to display the pdfs(i still need  to use some software to trim the white space on the pdf books, but it works).	1
	i am glad bought a refurbished kindle dx and no need to wait for the irex dr800sg.       	1
	love my kindle dx.	1
	i got this for my father, now getting one for my mother.....	1
	size matters!.	1
	awesome product.	1
	my first ebook.	1
	6 months and still loving it.	1
	kindle's my new bff.	1
	great, but still a work in progress..	1
	welcome to the future of books!.	1
	kick butt.	1
	best purchase i made this year.	1
	love the kindle.	1
	kindle dx review.	1
	rich p.	1
	terry.	1
	great reader, could use more books available and some usability tweaks.i have lots of books - my main furniture consists of bookcases - and i read things until the covers fall off.	1
	i love the idea of putting all the books onto one device, sort of a giant ipod for books.	1
	too bad many of my favorite authors don't seem to be available yet in electronic form... hopefully they will come along soon.	1
	my friend gave me this for my birthday (expensive gift!	1
	hugz to you if you ever see this!	1
	)and i love it!my son keeps eyeing it and wanting one, so it has the 'cool' factor.	1
	i have two little tiny things that bug me on the usability front, because i notice such things.	1
	first, because my hands are small i keep hitting the menu button with my thunb while reading a book.	1
	ease of reach is important, avoiding inadvertent actuation of controls is also important.	1
	if the buttons were further in from the edge this would not be a problem.	1
	second, also probably because my hands are not huge, i hold it below the halfway balnce point, which makes it slightly top heavy.	1
	if you don't read much this isn't a factor, but if you read for hours then the thumb and wrist tendons become fatigued.	1
	this could be alleviated with a weight in the lower part of the case, or by changing the balance point.	1
	ergonomics are a factor here and of course the design has to accommodate users from the small end of the spectrum to the large end.	1
	however, since the balance point is exactly the middle, i suspect that no deliberate change was made to the design for this issue.	1
	all in all, i love this and use it all the time.	1
	looking forward to more titles!      	1
	great gift.this was a great gift.	1
	works well-fast downloads, good prices.	1
	good selection including free and massive collections that are cheap.	1
	great for travel.	1
	screen is large and clear and easy on the eyes.	1
	buttons are well placed, easy to use and the 'keyboard' is easy to use as well.	1
	a few negatives--text to speech is 'flat', browser is not very functional, and no color.	1
	none of these is a major problem.	1
	if you read a lot this is for you.	1
	particularly with the cover it has the feel of a large (light) paperback.	1
	the pdf reader is a good plus.      	1
	i love this cool gadget.	1
	works as advertised.	1
	kindle dx.	1
	kindle dx review.	1
	worth every penny.	1
	save your money and buy a netbook, way overpriced!.my comments say it all, this device is not worth $500.00, why is a limited device more expensive than most modern netbooks and some fine laptops that can do way more than this overpriced gadget, heck i get more use out of my iphone!      	1
	kindle dx and a lefty.	1
	also, very brief comparison of the kindle 2nd gen and dx..some of the reviews of the dx ought to be available for download as short stories, in and of themselves!	1
	so i won't belabor the review issues.	1
	in short, we had both the kindle 2nd gen and the dx in our home at the same time; the kindle 2nd gen malfunctioned so we sent it back, but before we did, we ordered the dx and kept it.	1
	what a blessing!	1
	my lefty wife turned it 180 and locked the screen position.	1
	she prefers the buttons out of the way, (now at the top), and the next page button is now at her left thumb.	1
	my subjective opinion is that the kindle 2nd gen provides too cramped a reading space, (but it's my wifes kindle so that wasn't a consideration).	1
	we find *.pdf book drafts from time to time and with the dx the file download and compatability/usability issues don't exist.	1
	she prefers it naked so we bought the m-edge neoprene sleeve/slip case....another outstanding product.      	1
	best yet.	1
	kindle dx.	1
	just joined the e-reader club.	1
	kindle two is fabulous!	1
	!.	1
	very fine kindle.as an inventor living on both coasts---this is the best kindle.	1
	i can read the newspapers from both coasts as i travel---read patents that i have pdf'd to the kindle----and in between read the latest book i have an interest in.	1
	this is better than a computer for the traveler.	1
	get it!      	1
	just love it.i am not a geek with electronics.	1
	this is very user friendly, great for travel and home.	1
	i love the screen, it reads much like a book not a screen.	1
	if your on the edge...as i was, go for it!      	1
	almost perfect...a few suggestions.i see this as eventually replacing newspapers and magazines, let alone books.	1
	i wish it had wifi so it could surf the net while in a wifi hotspot.	1
	like the iphone, the kindle represents a totally new direction for a product, but its full potential has yet to be explored.	1
	the display is great, and hits the goal of appearing as print on paper.	1
	i think some of the content suppliers could format for this product better, but i realize that will take time.	1
	i can also see the kindle scrolling smoothly like the iphone.	1
	i realize that the look of the printed page was a goal, but while the display's static image hits that goal, i would suggest going beyond what the page can do with regard to scrolling and perhaps windows to other articles...also, it would be nice if the price were a bit lower...      	1
	fantastic and fun reading.this reader is amazing!	1
	downloads are fast and the library is huge.	1
	the screen utilizing the e-ink technology is very readable and clear, with great grayscale images as well.	1
	prior to owning this device, i never really had or took time for recreational reading, but with the kindle dx, i can't wait to get back to reading my growing library of books, periodicals, and news media.	1
	for me personally, one of the most helpful features is the ability to vary the font size.	1
	i can even read without my glasses on, if i want, with very little fatigue due to the extremely clear e-ink screen.	1
	sure, there's more frequent page turning with a larger font, but the device is so well designed that this is not a bother to me at all.	1
	i have looked at other brands of readers, and this is by far the very best version of the very best reader there is.	1
	enjoy!      	1
	what the ipod is to music, the kindle is to books.i bought my first kindle 1 last year around november, i loved it.	1
	it was small, it was not great with images, but at the same time the pluses far outweighed the minuses.	1
	i watched the kindle 2 come out and was very tempted, but held off.	1
	i was contacted to be part of a beta test for the dx.	1
	once i saw that, i knew i would be buying one when they hit the market.	1
	i've had my kindle dx since june, and it is an amazing device.	1
	for my needs, the kindle is perfect.	1
	i am either always reading a new technical book (usually large and heavy) or i like to keep a few reference sources with me, i travel every other week, and i enjoy reading...a lot.	1
	the unit itself works very well.	1
	power consumption is not an issue, if you are getting low...just turn wireless off.	1
	it lasts for days and days.	1
	the display is great, very easy to read even in direct sunlight.	1
	you can very comfortably sit around the pool and read your kindle dx without any display issues.	1
	the content for recreational reading is great, the content for technical books continues to grow and recently i have seen wrox and o'reilly series are available.	1
	the changes to the interface are very well done.	1
	it is more intuitive, easier to navigate, and the display is a perfect size.	1
	my grandfather bought one after i showed him how it works.	1
	we both love the built in dictionary.	1
	the adjustable font size makes reading a much easier experience for him.	1
	i subscribe to the la times, which is there every morning when i turn my kindle on.	1
	the format is very easy to read and i spend about 1/2 as much time as i normally would flipping through pages.	1
	i've just started sending pdf files over to my kindle, what a great feature this is.	1
	they are very clear, easy to download, and always accessible.	1
	i recently forgot to pack my kindle before a trip, i ended up using the kindle app on my iphone.	1
	the shared library was so functional and easy.	1
	it takes seconds to download a book on my iphone if i really need to.	1
	the reading experience is not the same of course, but the fact that i can read a book on my kindle, be stuck someplace waiting and continue reading on my iphone, and the pages automatically synch to the furthest read page....sooooo cool.	1
	it is an exciting time for reading devices, there is a lot of competition and a lot of ground breaking technology is coming into play.	1
	just like anything else though, it's all about the content.	1
	having amazon as the content delivery system for any device is where the big win is.	1
	if i had to synch up with my pc or something goofy to get content onto my reader, it would not be nearly as enjoyable.	1
	i have downloaded books while getting ready for takeoff (prior to the warning about turning off all devices).	1
	it is just too convenient.	1
	i am a huge fan of books, always have been and always will be.	1
	but there is nothing superior about reading a paper based book vs. reading the same book electronically.	1
	the feel of paper and the weight of a book are emotional indicators...but once you have read a few books with the kindle, it's the same experience.	1
	except it always remembers your page, and you can annotate notes, and it will read it to you if you like, or play music in the background, and the pages don't blow in the wind, and it weighs a fraction of what your books weigh, and you can slip it into your backpack or purse not even noticing the weight, and something i read recently  which i had not thought of...you know where your kindle has been.	1
	ever seen the seinfeld episode where george was trying to return a book he had in the bathroom and it was 'flagged'.	1
	obviously i love my kindle(s), are they perfect...no.	1
	would i like to see some better images or color...yes.	1
	but it's a great device at this time.	1
	the future will bring what it brings.	1
	and the price is not trivial...but well worth it.       	1
	size does matter.the new bigger kindle is an improvement - the larger screen and larger type face for those of us with visual difficulties both make life easier.	1
	shopping by wireless is fun and having international newspapers delivered instantly is a marvel.	1
	books are easy to read.	1
	any improvements?	1
	i would like more conversion of images in both newspapers and books.	1
	i'd also like bigger keys or more striking labeling.      	1
	kindle dx.very cool technology.	1
	in some ways better than a book, in some ways the book still rules.	1
	i bought the dx thinking i was going to get the wall street journal.	1
	they raised the price of the kindle wsj, and at the same time wsj offered a subscription to the paper version for $50 for a year.	1
	the smaller version of the kindle would be absolutely fine for regular books, and easier to carry and hold as well.	1
	i live in a rural area outside san diego, and while i get normal cell phone reception, i have to leave the house to get a book to download (or hook it to my computer).	1
	i also find the downloads typically take closer to 5 minutes rather than the best case, advertised 1 minute.	1
	i like the paging function, i like reading it, i like that i can have many  books on the device at any one time.	1
	its nice to have the pdf reader built in.	1
	battery life is very acceptable as long as i don't leave it in the mode where its trying to find a signal, then the batteries last less than a day.	1
	normally they last 2 or more weeks.	1
	i bought the hard leather cover, and feel that its a requirement if you are going to carry the kindle anywhere.	1
	the screen would be too easily damaged without it.	1
	i worry about the kindle getting too hot in the car.	1
	so when i go to my girlfriends house, i take the kindle inside.	1
	when i leave however to do errands etc on the way home, its a very real possibility that it could be permanently damaged by heat in the car.	1
	i have to plan my stops, and skip some if i have the kindle with me (or take it with me, but that can be cumbersome too).	1
	i really miss the ability to share a book i've read.	1
	every book i read that i like, i want to be able to lend it to one of my friends or family that i know would enjoy it.	1
	that just doesn't work with the kindle.	1
	and i do miss the feel and smell of books.	1
	i also miss not being able read the front and back covers, along with the reviews in the front, not to mention some of the graphics and pictures.	1
	i could get over all that to have the other benefits of kindle if it weren't for the lack of ability to share what i've read.	1
	now that i'm used to the touch screen on the iphone, i find the kindle interface frustrating to have to translate what i want to do to using the menu and little joystick.	1
	i'm used to the kindle now, but it feels like old technology to not have the touch screen.	1
	while over 300,000 books sounds like a lot, i have found a number of books i wanted to read that are not available for the kindle.	1
	frustrating.	1
	big difference between many choices, and 'anything you want to read'.	1
	for traveling, reading in bed, instant access to books, remembering the last page read, and using the dictionary, the kindle is outstanding.	1
	there is clearly a place for this marvel.	1
	however, i still miss a good physical book.      	1
	kindle dx is awesome!.i never owned a kindle before my dx, so i am not familiar with the upgrades as well as others, but what i can say is: all the promotional advertisements are true.	1
	the kindle dx has definitely lived up to what the ads say.	1
	i have my library of books everywhere i go now.	1
	i love it!      	1
	good with room for improvement.reading on the kindle dx is great.	1
	there is no shortage of books and the control of the font size is really nice.	1
	prosnice device, feels good in the hands, well madetons of books to choose fromeasy to usegreat control over things like the font sizegreat battery lifenetwork connectivity is really nice consfont setting you make in books don't carry over to device menus, kindle store, or notes (major flaw)no control over contrastthe keyboard is an absolute joke.	1
	too small to use and the printed letters are so small i need reading glasses to see them.	1
	one of the big benefits of the kindle is it's ability to make the text large when reading a book and the keys on the keyboard don't stay with that.i wish i could browse the web on it.	1
	in a future version i think touch screen would really make this a better device.	1
	that being said it's really a good product.        	1
	kindle book prices.just received my new kindle dx and it's just what i expected and i'm well pleased with it.	1
	then i started to look for kindle books to order expecting to find decent prices.	1
	what i found was prices for new books coming out, like james patterson's ''i cross'', john sandford's ''rough country'', and ''vince flynn's ''pursuit of honor'' were just about $1.00 less than the non-kindle book price.	1
	one of amazon's selling points is a much lower price for kindle books, but what i find is not the case.	1
	i buy books when they first come out, i don't want to wait a couple of months for the price to drop to kindles $9.99.	1
	if kindle book prices remain high for best sellers that just hit the street,i can go to sam's and pay the same as i'd pay by shopping at amazon.	1
	if i have to do that maybe i don't need a kindle.	1
	paul      	1
	best birthday ever!.i bought the kindle dx as a birthday present to myself and it was the best purchase i have ever made.	1
	since i bought the device about a month ago i have read everyday and have completed well over 10 books.	1
	i have even revisited some of the classics that are free downloads from the kindle store!	1
	if you love reading, you will love this device!	1
	the screen is large and so easy to read.	1
	for people who are concerned about the tactile experience of holding a book and turning pages, i promise you won't be disappointed.	1
	the device is weighted in ways that are very similar to books and there are plenty of opportunities to 'turn pages.'	1
	this device has far exceeded my expectations and now i'm trying to find ways to integrate even more parts of my life into the device.	1
	uploading my schedule for the week (pdf format) and my songs for a little background music.	1
	i keep finding new features and opportunities with the kindle dx and i can't wait to see what more there is to come!      	1
	kindle dx the most fantastic unit - a must have.the kindle dx is extremely easy to use and easy to read.	1
	within 10 minutes i had gone through the instructions and ordered my first 16 books, a few of them free.	1
	the others were at minimum $2 less than costco's prices.	1
	it's easy to hold; it returns to previous pages or items quickly; the print is perfect for tired eyes, but can be changed easily too.	1
	the dictionary is terrific.	1
	i seldom need it, but when i do, phew, it's thorough.	1
	the only problem that i've found so far is that i'm using waaaay too much and will have to also buy my husband and son one each as i don't like to share!      	1
	kinkle dx.	1
	the perfect reader.i love this book reader!!	1
	having any book i want at my fingertips whenever i want is so delicious!	1
	i like the covers that are offered (got a red one) and will be getting the light.	1
	i do wish it had a built in light, but, it's great as it is.	1
	this is the perfect gift for yourself or someone who loves to read.	1
	i carry it everywhere, it fits right into my bag.	1
	i recommend the kindle dx to everyone.      	1
	excellent for the avid no clutter reader!.this is great!	1
	for anyone who is complaining you need to remember that they just came out only a year ago and are still trying to make perfections.	1
	i have been extremely happy and have had no difficulties at the present time.	1
	thanks amazon!	1
	my only question is why is there an app for the iphone and not other companies?	1
	especially since you use sprint (crappy company) for the tower signal.	1
	anyhow, if you would get apps for other services too, i would be over the moon!	1
	thanks again.scarlett      	1
	kindle dx.this is a fantastic item.	1
	i am really enjoying it and i am still discovering all the terrific things it can do.	1
	i would recommend it to everyone.      	1
	kindle dx.	1
	excellent reader.	1
	kindle dx.this product is a wonderful thing with room for improvement.	1
	it needs to be able to produce tables and charts and carry more photos but not having advertisements while reading the newspaper is great!	1
	i will be pleased when there are more books available as the selection now is quite limited and i feel rather expensive when a used hard copy can be purchased for half the price.	1
	i was also dismayed, at the price of the product, that the cover is sold separately and rather expensive.	1
	i should have done more research before making my purchase but overall i am very pleased with the concept and the usage.      	1
	almost perfect.i absolutely love my new kindle dx.	1
	it does almost everything i could hope for in an e-book reader.	1
	i am away from home a lot in my job so the wireless 'whispernet' feature allows me to easily download books on the go.	1
	i can also keep up to date automatically with daily newspapers or periodic magazine subscriptions.	1
	the larger screen in nice especially when looking at charts and graphs in pdf documents.	1
	the only negative point i have about the kindle dx is that pdfs are not searchable.	1
	the kindle treats them like a scanned document and does not recognize the words of the document.	1
	other than that, the kindle dx allows me to carry all my work documents and manuals plus any personal and professional reading in a single, small package wherever i go.      	1
	kindle dx review.the unit appears to be solid, and performs well.	1
	my main complaint, is a lot of the books i want to read are not on kindle.	1
	i clicked 'tell the publisher you want to read this book on kindle', but so far none of them have shown up.	1
	secondly, is you can't go to a table of contents, and pick a chapter of page to goto.      	1
	kindle dx.i have had my kindle for about a month so far, and i love my kindle dx and very happy with my purchase.	1
	so far, the couple of drawbacks i have seen and would like to see in future kindles is that i really, really wish it had a backlight so i could read it when it starts to get dark.	1
	when it starts to get dusk or when we go camping, my husband goes to bed early, i would like to read my kindle so i don't disturb him and without having to have the stupid separate light.	1
	i'm always trying to figure out where i had put it last.	1
	also, i don't care for how the screen rotates automatically.	1
	i would prefer it to rotate when i indicate it should.	1
	because i have problems with my arms and wrists, i tend to hold my book at a slant and the kindle will rotate the screen, frustrating me to no end.	1
	and, lastly, i would like the kindle to accept html's without having to send them amazon to reformat and then amazon charging me for each book they reformat.	1
	i had an old rocket so i have lots and lots of html's.	1
	i believe i shouldn't be charged anything to reformat any of my ebooks to load onto my kindle.	1
	other than those few drawbacks, i would really recommend the kindle dx.	1
	because it can hold so many books, i really like the idea of putting all my books on my kindle so i can read, and re-read, any of my books at any time.	1
	i carry it with me everywhere.	1
	good job, amazon.	1
	just correct those minor problems and you would have an absolute winner and one i would eagerly upgrade to.      	1
	first kindle purchase, started w/ dx.being an avid reader, the task of disposing, trading, donating read books can become tiresome.	1
	i finally decided to purchase the dx.	1
	although, i still think it is expensive, i really really like using it.	1
	only once has a book been purchased that i did not intend to buy, (still confused how it happened), but i understand there is a way to remove books that were not supposed to be purchased.	1
	although i feel like i need to get a larger handbag to fit the dx with it's cover, it is not difficult to transport around.	1
	no one knows what i'm reading, or half the time what i'm doing with the device.	1
	and no more books stacked up in a corner!	1
	i would recommend only for the avid reader, otherwise, it is an expensive device that you'll never get your money worth.       	1
	big screen beauty.i've owned a kindle 1 and a tiny kindle 2.  i received my kindle dx 3 weeks ago, so i'm writing from a bit of a perspective.my perspective - this thing is huge!!!!	1
	!this is the best of the 3 kindles because of the big, beautiful screen.	1
	i've read all the negative whining about the weight, the inability to fit it into a little purse, etc.	1
	etc.	1
	!the weight doesn't bother me and i don't have a purse.but what i do get is the same feeling i got when i first hooked up my 24' monitor to my macbookpro = wow!	1
	this kindle is expansive.	1
	i think the decision to go with one set of buttons is inspired.	1
